id,sentence,sentiment_Stanford,sentiment_Google Cloud,sentiment_Monkey Learn,Grand Truth
1,The Real Estate Institute of Australia report highlightedhousing affordability in the state had declined against income to cope with loan repayments,Negative,Positive,Negative,Negative
2, This meant repayments overall constituted 26.3 per cent of a household's income,Neutral,Neutral,Negative,Neutral
3, The average loan repayment in Tasmania was$275;217 in December compared to$266;839 the year before,Negative,Negative,Neutral,Negative
4, The average monthly repayment was$1663 against a median family income of$1458,Negative,Neutral,Neutral,Neutral
5, The state's rental affordability improved over the period with the proportion ofincome required to meet median rents downto 28.1 per cent,Negative,Positive,Neutral,Negative
6, Social service organisations sayif a person's rent is above 30 per cent of their income; this places them under housing stress,Negative,Neutral,Neutral,Neutral
7, Firsthome buyers increased by 12.6 per cent over the three months and 23.3 per cent over 12 months,Neutral,Neutral,Neutral,Neutral
8, March 6 2019  12:30PM Real Estate Institute of Australia report for December quarter released Matt Maloney Local News facebook SHARE twitter TWEET email whatsapp A national housing affordability report has shown Tasmania had the largest rise in house repayments in the country over the December quarter,Negative,Neutral,Neutral,Neutral
9, The Real Estate Institute of Australia report highlightedhousing affordability in the state had declined against income to cope with loan repayments,Negative,Positive,Negative,Negative
10, This meant repayments overall constituted 26.3 per cent of a household's income,Neutral,Neutral,Negative,Neutral
11, The average loan repayment in Tasmania was$275;217 in December compared to$266;839 the year before,Negative,Negative,Neutral,Negative
12, The average monthly repayment was$1663 against a median family income of$1458,Negative,Neutral,Neutral,Neutral
13, The state's rental affordability improved over the period with the proportion ofincome required to meet median rents downto 28.1 per cent,Negative,Positive,Neutral,Negative
14, Social service organisations sayif a person's rent is above 30 per cent of their income; this places them under housing stress,Negative,Neutral,Neutral,Neutral
15, Firsthome buyers increased by 12.6 per cent over the three months and 23.3 per cent over 12 months,Neutral,Neutral,Neutral,Neutral
16,Arts About us Story Archive Comments PolicyOf real estate; roses and living in the CBDBy SUZANNE VISSERWe left Alice Springs in 2009; after having lived here for more then a decade; because we wanted to buy a house and we were disgusted by the prices which had just gone up again; this time by 40%,Negative,Negative,Negative,Negative
17,I had just sold a business in Alice and decided to invest somewhere else,Neutral,Negative,Negative,Negative
18, Erwin Chlanda wrote an article about our departure; it was accompanied by a photo of us in the Mall; suitcases ready,Negative,Neutral,Negative,Negative
19,Alice; Love it; leave it the article was headed and it described how yet another business owner was leaving; taking her money out of Alice Springs,Negative,Positive,Negative,Negative
20, That business owner was me,Neutral,Neutral,Neutral,Neutral
21,What the photo did not show was my bleeding heart,Neutral,Negative,Neutral,Neutral
22, Ive always loved Alice; and Alice had always been good to me,Positive,Positive,Positive,Positive
23, Yet I was going to betray her; because of her real estate prices and what you could get for them,Negative,Negative,Negative,Negative
24, I cried that whole first day of the road trip to NSW,Positive,Positive,Positive,Positive
25,To cut a long story short: were back since 2012,Negative,Negative,Neutral,Negative
26, We lost the business that we bought and the house that we bought in NSW and everything else we owned,Negative,Negative,Negative,Negative
27, If I say drug Mafia; I probably do not have to explain more,Negative,Negative,Negative,Negative
28, If I say Nimbin you understand the whole story perhaps,Neutral,Neutral,Neutral,Neutral
29,What is important is that we chose to come back to Alice to find work after disaster had struck in NSW,Negative,Negative,Negative,Negative
30, Work in Alice Springs was; as usual; found in a wink,Neutral,Neutral,Positive,Neutral
31, Now we needed a house,Neutral,Positive,Positive,Positive
32,Buying was out of the question this time,Neutral,Neutral,Neutral,Neutral
33, I arrived in Alice in June 2012; six months before my husband; and lived in a share house until he joined me,Negative,Neutral,Negative,Negative
34,The share house was in a Sadadeen street that was described to me on numerous occasions as a war zone,Negative,Neutral,Neutral,Neutral
35, I decided to live in this war zone just to check out what it would be like,Neutral,Neutral,Positive,Neutral
36,I had after all lived next to the river and opposite the salt bush for many years and had walked through it to take short cuts; also at night; only to be shouted at: Hey sis; nice boots! or Want a piece of chicken; sista,Neutral,Neutral,Negative,Neutral
37,I had never locked the gates to my business; not even at night; and nothing was ever stolen except for an aluminium rose that was part of an art work,Negative,Negative,Negative,Negative
38, When I reported the stolen rose to the Alice Springs News ; Kieran Finnane wrote an article about it and a new rose appeared out of thin air!This was brought about by Mike Gillam in the Alice News of 23 October 2008,Negative,Negative,Neutral,Negative
39,The case of the stolen roseSir; Re,Neutral,Negative,Negative,Negative
40, letter to the editor pleading for the return of a stolen rose; one of three made from recycled aluminium cans by bulldozer driver; occasional sculptor and currently; law student at University of Adelaide; Simon Holding,Negative,Neutral,Negative,Negative
41,To create this exquisite vase of roses Simon painstakingly deconstructed actual roses and replicated them in metal; petal by petal,Negative,Positive,Positive,Positive
42, The artwork was subsequently sold during an exhibition of sculptures at the silver bullet cafe in 2006,Negative,Neutral,Neutral,Neutral
43,Simon was touched by the sentimental value placed on his work by local business woman; Suzanne Visser; and asked me to send her a replacement rose,Negative,Neutral,Positive,Negative
44, He also offered to weld all three long stemmed roses and the vase to an appropriate counter; plinth or other heavy steel surface!To the person who stole the sculpture I would like to add: there is a big difference between taking a flower from a garden and stealing artwork and hopefully this difference will tarnish you in the eyes of the recipient,Negative,Neutral,Negative,Negative
45,Mike GillamAlice SpringsAfter the story of the rose and my experience walking in the river and through the salt bush during my first time around in Alice I decided to ignore the war zone remarks and moved to Aneura Place in Sadadeen to wait for my husband to join me,Negative,Negative,Negative,Negative
46,I decided to never lock my car and leave things in it overnight: small items like a jumper; some change; a half full pack of cigarettes; a bottle of beer; a new towel,Negative,Negative,Positive,Negative
47,Not only did I never encounter anything that remotely resembled a war zone in that street; my car was never; not even once; opened,Negative,Negative,Negative,Negative
48, I checked this by sticking pieces of paper between the doors and the body of the car whenever I closed the unlocked doors,Negative,Negative,Negative,Negative
49,It was an experiment,Neutral,Neutral,Neutral,Neutral
50, It went on for six months,Neutral,Neutral,Neutral,Neutral
51, In the end I was almost hoping that something would happen; that someone would at least take that handful of gold coins that were there in plain view  but noone ever did,Negative,Negative,Negative,Negative
52,I decided to tell this war zone story to the Alice Springs News as soon as it would be appropriate to do so,Neutral,Neutral,Neutral,Neutral
53, That time has come now,Neutral,Neutral,Neutral,Neutral
54, That unlocked car is not in that street anymore; it is somewhere in the CBD,Negative,Neutral,Negative,Negative
55,When the good old peaceful quiet share house days in Sadadeen were over and my husband and I were ready to rent a house together we decided it was going to be either out bush (Colonel Rose Drive and surroundings; Ilparpa; Ross Highway)  or the CBD,Neutral,Positive,Neutral,Neutral
56, No suburbs for us this time,Neutral,Negative,Neutral,Neutral
57,The CBD is not what you call hip; but we would make it hip by moving there; we told ourselves,Negative,Negative,Negative,Negative
58, And the bush; well the bush has been hip for years,Positive,Positive,Negative,Positive
59,The bush did not work out in time; there was nothing suitable available,Negative,Negative,Negative,Negative
60, So the CBD it was,Neutral,Neutral,Positive,Neutral
61, People were listening with eyebrows raised to our plans to possibly rent in the middle of the CBD,Neutral,Neutral,Negative,Neutral
62," What about the noise; the fighting; the screaming; the vomit; the pee and the poo,  they asked",Negative,Negative,Negative,Negative
63,We shrugged,Neutral,Negative,Negative,Negative
64, Maybe we were againembarking on something insane; but this time we had nothing to lose,Negative,Negative,Negative,Negative
65, So we did not listen to all well meant advice and warnings and moved to the CBD,Negative,Negative,Negative,Negative
66, That was three months ago,Neutral,Neutral,Neutral,Neutral
67,Were 0 minutes from Kmart; 0 minutes from Yippy and 0 minutes from Coles,Negative,Neutral,Negative,Negative
68, We have range views,Neutral,Positive,Neutral,Neutral
69, And you cannot imagine the peace and quiet,Positive,Positive,Positive,Positive
70, We love it!We hardly use the car,Neutral,Positive,Positive,Positive
71, Woollies is our pantry and our freezer,Positive,Positive,Positive,Positive
72, Montys is around the corner,Neutral,Neutral,Neutral,Neutral
73, We walk to work,Negative,Neutral,Neutral,Neutral
74, I have not encountered much noise; or screaming; vomit; pee or poo at all,Negative,Negative,Negative,Negative
75,Its a bit too quiet here in the evenings,Negative,Positive,Positive,Positive
76, If only everyone would come to the CBD we could create for ourselves a nice; convenient; cozy; hip town centre where businesses are open after 5pm and tourists like to dwell,Negative,Positive,Positive,Positive
77, Theres vacant land and buildings galore,Negative,Neutral,Neutral,Neutral
78,The CBD is not dangerous; I go anywhere; on foot; at any hour of the night; yes also to the 24 hour shop,Negative,Neutral,Negative,Negative
79, I cross the Melanka site,Neutral,Neutral,Neutral,Neutral
80,And I dream of how nice it would be if people would live above all these shops; where now dark windows gape,Negative,Positive,Negative,Negative
81, If people would go out for a stroll and meet on the corners of the streets for a yarn,Neutral,Positive,Neutral,Neutral
82, If there would be light behind these windows and shop fronts,Neutral,Positive,Neutral,Neutral
83, If people would sit on their balconies watching the world go by,Neutral,Neutral,Negative,Neutral
84,Imagine an Alice with a CBD like Venice; where one can hear footsteps on the pavement and music coming from little cafes,Negative,Positive,Negative,Negative
85, Why not in Alice,Negative,Neutral,Neutral,Neutral
86, Weve got it all: the weather; the stars; the clean air; the international community; the empty buildings,Positive,Positive,Positive,Positive
87,All we need is people,Neutral,Neutral,Neutral,Neutral
88, And you dont even have to be brave,Positive,Neutral,Positive,Positive
89, It is perfectly okay in the CBD,Positive,Positive,Positive,Positive
90,Photos: Suzanne and Mike  sad to leave; happy to be back,Positive,Negative,Positive,Positive
91,Be Sociable; Share!TweetPosted: June 1; 2013 at 3:33 pm   Post a comment8 Comments (starting with the most recent)NB: If you want to reply to a previous comment; start your comment with this notation: n where n is the number of the comment you want to reply to,Negative,Neutral,Neutral,Neutral
92,VeronicaPosted January 4; 2015 at 7:17 pmWhat a lovely; inspiring story,Positive,Positive,Positive,Positive
93,View CommentRick EverettPosted July 28; 2013 at 9:24 amThanks for your insight Suzanne,Negative,Neutral,Positive,Negative
94, I am currently contemplating a move from Newcastle NSW to Alice Springs; having been offered a new job there,Negative,Neutral,Positive,Negative
95, I know little about the area and it is great to read Positive stuff given that is a big move for our entire family,Positive,Positive,Positive,Positive
96, Perhaps I will bump into you in the new hip CBD,Negative,Neutral,Neutral,Neutral
97, All the best Rick,Positive,Positive,Positive,Positive
98,View CommentSandyPosted June 5; 2013 at 9:47 amThanks for the uplifting story; Suzanne,Negative,Positive,Positive,Positive
99, You; Mike; Bob; all of you are right  Alice is a great town and I would like a dollar for all those who have left; only to return at a later date,Positive,Positive,Negative,Positive
100, One day the CBD will be filled with residential living and shops will be abuzz again,Positive,Neutral,Neutral,Neutral
101, Sooner; rather than later; I hope,Negative,Neutral,Positive,Negative
102,View CommentSuzanne VisserPosted June 2; 2013 at 10:35 amBob Durnan; Conventional Negative doomsaying bullshit that is served up with monotonous regularity,Negative,Negative,Negative,Negative
103, Well said! Thats exactly the point I wanted to make,Neutral,Positive,Positive,Positive
104, There is the occasional aggressive drunk here; yes,Positive,Neutral,Positive,Positive
105, But compare that with a town like Byron Bay (we were close to this once beautiful coastal town); which has now become the most dangerous town of NSW,Neutral,Positive,Negative,Neutral
106, The fuel for aggression there is not grog but speed,Neutral,Neutral,Neutral,Neutral
107, In Byron Bay whole gangs go party crashing base ball bats in hand,Neutral,Negative,Positive,Neutral
108, Murder is a regular occurrence,Neutral,Neutral,Neutral,Neutral
109, Not to mention Nimbin; once the place to go and find peace and love,Neutral,Positive,Positive,Positive
110, Semiorganised crime is everywhere in those beautiful hills and what is worse: the police there is useless,Negative,Negative,Negative,Negative
111, The police here are great,Positive,Positive,Positive,Positive
112, Compassionate but firm,Neutral,Positive,Positive,Positive
113, And our social services; such as the YSOS; but also the Womens Shelter; DASA; CAAAPU; and the social workers at Centrelink; to name only a few; are second to none,Negative,Neutral,Neutral,Neutral
114, Ive always thought that the spaces above shops in the CBD should be converted into living accommodation and I also think Alice Springs needs a stunningly built skyscraper by a upcoming killer architect; somewhere in the desert; to attract tourists and to solve the housing problem,Negative,Neutral,Negative,Negative
115, Something with a museum on the ground floor and a restaurant on the top floor and a panorama like we once had by Hank Guth; and apartments with stunning desert views; some of the apartments lofts with only the bare minimum so that people can build them up at their own pace,Positive,Positive,Positive,Positive
116, If I were rich that would be a project I would embark on tomorrow,Neutral,Neutral,Neutral,Neutral
117, As for now I long to work again for one of these amazing organisations mentioned above,Positive,Positive,Positive,Positive
118,View CommentBob DurnanPosted June 1; 2013 at 9:48 pmThanks Susanne; great to hear from somebody who is prepared to look at the town with fresh eyes; and not fall for the conventional Negative doomsaying bullshit that is served up with monotonous regularity in all manner of the towns forums,Negative,Neutral,Negative,Negative
119, I (and several others who comment here) have written about similar experiences of the river and CBD at night over the last couple of years,Neutral,Positive,Neutral,Neutral
120, If you know what you are doing; treat people with respect; dont overreact to the occasional angry drunk; and take a bit of care around any current known trouble spots; you are unlikely to strike any trouble in the CBD or riverbed areas during the evening or daytime,Negative,Positive,Positive,Positive
121, This applies especially over the last 15 months since the diligent work of the nighttime youth outreach workers (YSOS) has reduced antisocial behaviour by bored and alienated youth to a very low level; supported by excellent policing and daily followup by social workers who liaise with the youth and their families,Negative,Neutral,Negative,Negative
122, If more shops were set up with accommodation included or converted to town houses; and more flats were built around the CBD (without going overboard in terms of height) I am sure that the CBD would be rejuvenated and provide a wonderful living environment,Negative,Positive,Positive,Positive
123,View CommentGini KesslerPosted June 1; 2013 at 8:52 pmSuzanne; your courage along with Mikes has truly inspired me,Negative,Positive,Positive,Positive
124, Having known you since the 90s in Tokyo; youve had to contend with so much adversity,Neutral,Positive,Positive,Positive
125, Youll never know how much I admire you and all your accomplishments,Positive,Positive,Positive,Positive
126, Your giving; loving heart that has reached out to help only to get stepped on again and again; but you just keep being yourself and reaching out to others,Negative,Positive,Positive,Positive
127, You are one in a million in my book and Im proud to call you my friend! GiniView CommentSuzanne VisserPosted June 1; 2013 at 8:18 pmMike Gillam; Nice to hear you again! Thank you for your kind words,Positive,Positive,Positive,Positive
128, The word rose seems to still be current between us,Neutral,Neutral,Negative,Neutral
129, This time in rose coloured glasses,Neutral,Neutral,Neutral,Neutral
130, Yes; our town can be dangerous at times; but where we decided to settle; on the East Coast; was a zillion times more dangerous,Negative,Neutral,Negative,Negative
131, I think danger also depends on ones own attitude and hey; it is nice to write about something nice for a change,Positive,Positive,Negative,Positive
132, Not all is gloom and doom and theres much about our town that can and should be enjoyed,Negative,Neutral,Positive,Negative
133, I saw it with fresh eyes when I came back and compared to many towns in Australia it is colourful; multicultural; a town of painters; and very very laid back,Positive,Positive,Positive,Positive
134, The friendliness of the people was also something I had almost forgotten in my two years of absence,Negative,Positive,Positive,Positive
135, Kind regards; Suzanne VisserView CommentMike GillamPosted June 1; 2013 at 6:11 pmSuzanne and Mike; Nice to hear youre back in town and Im sorry to hear of your experiences on the east coast,Negative,Positive,Negative,Negative
136, Many thanks for reminding us that stereotyping people; suburbs and places like Alice Springs denies the existence of a greater reality and sometimes treating people as trustworthy is a good starting point,Positive,Neutral,Positive,Positive
137, And Im sure youre wise enough to know that youll be disappointed on occasion,Negative,Positive,Negative,Negative
138, Before someone pours scorn on you with a jibe about seeing the world through rose tinted glasses; may I suggest caution walking around the CBD at night,Negative,Neutral,Positive,Negative
139, Unfortunately our town; like many places around the country; is not totally safe at night,Negative,Negative,Negative,Negative
140, Risk taking should be measured and the consequences of getting it wrong should always be considered first,Negative,Negative,Positive,Negative
141, That said; the CBD can only benefit from your presence and good will,Positive,Positive,Negative,Positive
142,View CommentPost a CommentYour email is never shared,Negative,Neutral,Negative,Negative
143, Required fields are marked *Name*Email*WebsiteComment,Negative,Neutral,Neutral,Neutral
144,What did we just watch,Neutral,Neutral,Neutral,Neutral
145,!You might be thinking exactly this after viewing this advertisement; that looks more like something that belongs on a porno website,Negative,Negative,Negative,Negative
146,The ad is acutally for a real estate listing for a Sydney property and since its release it has gone viral online because its extremely sexual undertones and pounding music legit reminds people of the intro to a bad porn video,Negative,Negative,Negative,Negative
147,Yep; all thats basically missing is a bomb chicka wah wah sound effect,Negative,Positive,Negative,Negative
148,The video is supposed to showcase a fourbedroom house for sale in south west Sydney but since it was posted on Realestate,Negative,Negative,Negative,Negative
149,com on Wednesday; people have become more focused on the people in the ad who are seen dancing seductively on a table,Neutral,Neutral,Positive,Neutral
150,It was quickly shared around on Twitter and has received a roasting of spectacular fashion in the process,Positive,Positive,Positive,Positive
151,Some people called it so breathtakingly horrific that it borders on art and the most Real Estate Agent video I have ever seen,Positive,Neutral,Negative,Positive
152,Others commented on the seemingly awkward layout of the house; especially the fact that the swimming pool runs right past the window of the ensuite bathroom,Negative,Neutral,Positive,Negative
153,also for those in this thread asking if the toilet has full line of sight to the kitchen/dining room; the answer is unequivocally yes pic,Negative,Neutral,Positive,Negative
154, April 17; 2019Never mind the video; the houses layout looks like it was a student project; said one person,Negative,Neutral,Negative,Negative
155, Omg the swimmer can watch someone wee; another joked,Negative,Neutral,Positive,Negative
156,The video has since been removed from the official listing on LJ Hookers website and from their youtube account,Negative,Negative,Negative,Negative
157,The real estate agent for the property; Sam Nader from LK Hooker Bankstown; has since come out in defence of the video; saying it was meant to be a spoof,Negative,Negative,Negative,Negative
158,I just wanted to do something different in the industry; and it really; really worked; he said,Positive,Positive,Positive,Positive
159,I did one for a hour in Illawong and it broke the record for the area  $3;205;000; sold before auction,Positive,Negative,Negative,Negative
160,Video gets attraction to the property; and the whole point of real estate is to get as many eyes as possible on the property,Positive,Positive,Negative,Positive
161, It was supposed to be funny,Neutral,Negative,Negative,Negative
162, Whether its funny; its rude of its sexy; every video I do is different,Neutral,Negative,Neutral,Neutral
163,LJ Hooker on the other hand released a statement apologising if the video offended anyone; saying they missed the mark,Negative,Negative,Negative,Negative
164,We understand that our recent video circulated on social media promoting one of our listing may have been taken out of context by some and for this we apologise; the statement read,Negative,Neutral,Negative,Negative
165,We have removed the video from our digital and social media channels,Negative,Negative,Negative,Negative
166,At least everybodys talking about the property now! Any publicity is good publicity; right,Positive,Neutral,Negative,Positive
167,Why fewer adults are leaving home It made George Costanza the butt of jokes on hit sitcom Seinfeld; but there are now more young Australians living like George than ever before,Negative,Neutral,Negative,Negative
168,Mum puts home; land; cash; business up for $55 raffle A Queensland mum has put her entire lifes work up for raffle; mega lottery style  house; land; cash; business; the lot for $55 per chance,Negative,Positive,Negative,Negative
169,Big catch with Scott Morrison's $500m housing splurge It is supposed to give first home buyers a muchneeded leg up  but experts have warned of glaring holes in this radical new scheme,Negative,Neutral,Negative,Negative
170,PM bets house on promise to firsthome buyers Firsthome buyers have been targeted in a bold pitch by the Prime Minister to woo voters; slashing the amount of cash wouldbe homebuyers need to save before auction,Negative,Positive,Negative,Negative
171, Heres who would qualify,Neutral,Neutral,Neutral,Neutral
172,Noosa Hill houseprice record set by masterpiece with views RIVIERA  a dazzling property masterpiece  has set a new record for Noosa Hill,Positive,Positive,Positive,Positive
173,Make your bedroom a dream scene Turn your bedroom into an organised; calm sanctuary with these styling tips from an interiors expert,Negative,Positive,Positive,Positive
174,Luxury home in sought after location is the complete package 'It's the sort of home everyone wants'Thors haven Australias most expensive town It is home to some of our biggest celebrity names; and Thors mega mansion,Negative,Positive,Positive,Positive
175, Now this hippie haven can also lay claim to another illustrious title,Neutral,Positive,Positive,Positive
