id,sentence,sentiment_Stanford,sentiment_Google Cloud,sentiment_Monkey Learn,Grand Truth
629," Most Viewed in National Loading Advertisement The Age Twitter Facebook Instagram RSS Our Sites The Age The Sydney Morning Herald Brisbane Times WAtoday The Australian Financial Review Domain Traveller Good Food Executive Style The Store Drive RSVP Essential Baby Essential Kids Weatherzone Classifieds Tributes Celebrations Place your ad Commercial Real Estate Oneflare The Age Contact  support Advertise with us Newsletters Accessibility guide Sitemap Photo sales Purchase front pages Content licensing Our events Work with us Conditions of use Privacy policy Press Council Products  Services Subscription packages Subscriber benefits My account Subscriptions FAQs Today's Paper Copyright  2019 Feedback Subscribe"""",1,Negative
NULL,NULL,Supplied THE original home of The Echo newspaper in Ocean Grove has sold to a local family""",Neutral,Negative,Neutral,Neutral
630, The buyers of 103 The Parade plan on building a family home on the site after securing it for a price within the asking range of $1 million to $1.1 million,Neutral,Negative,Neutral,Neutral
631, Point Lonsdale agent Campbell Potts said there were two main players that were interested in the property at the end of the expressions of interest campaign,Neutral,Neutral,Negative,Neutral
632, MORE REAL ESTATE:Local familys after auction offer secures dream home in Hamlyn Heights Whats next for Geelongs property market as lossmaking sales hits 16year low Modern builds attract top dollar in popular South Geelong John Townsend with an early edition of the Echo outside the house where it was founded in 1962,Negative,Positive,Neutral,Negative
633, Picture: Alan Barber Source:News Corp Australia Plans to build a family home was one of the reasons the vendors liked the successful buyer; Mr Potts said,Positive,Neutral,Positive,Positive
634, There was development potential for the 811sq m site within 200m of the town centre; subject to council approval,Negative,Neutral,Neutral,Neutral
635, The threebedroom character house was built in 1948 and was the original home of The Echo newspaper; that was initially a newsletter,Negative,Neutral,Neutral,Neutral
636, The property is in a central location,Neutral,Neutral,Neutral,Neutral
637, Source:Supplied The buyers plan on building a family home on the site,Neutral,Positive,Neutral,Neutral
638, Source:Supplied Alix and John Townsend started the paper in 1962 and their son John bought out his siblings when his mum died in 2008,Negative,Neutral,Neutral,Neutral
639, Mr Townsend said it was a very busy household and all the local news was basically brought by people to the front door,Negative,Positive,Negative,Negative
640, Why location is everything in real estate 1:58 Why location is everything in real estate September 10th 2018 4 months ago /display/newscorpaustralia,Negative,Negative,Neutral,Negative
641,There was always something happening; people used to say if they wanted to know what was happening they would come to our house; he said,Negative,Negative,Negative,Negative
642, Someone turned up with a fairy penguin one day that they had found and mum and dad knew someone that could help them out,Negative,Positive,Neutral,Negative
643, As the paper grew an office across the road was used to run the paper before the Geelong Advertiser eventually bought the newspaper 15 years after it started,Neutral,Neutral,Neutral,Neutral
644,"The Domain 2015 School Zones Report has found catchment zones for some of the state's most sought after public schools has seen a significant increase in price during the past 12 months""",Negative,Neutral,Neutral,Neutral
645, Properties located near Strathfield Girls High School tops the list for secondary education; with 38.6 percent growth taking median property prices to $1.3 million,Negative,Neutral,Neutral,Neutral
646," Education is a growing part of the equation that can drive prices higher;"" Domain Group senior economist Dr Andrew Wilson said",Neutral,Neutral,Neutral,Neutral
647, The cost of homes in the school zone around Parramatta Public School rose by 56.5 percent to $1 million; while property close to Ashbury Public School rose by 46.6 percent to $1.4 million,Negative,Neutral,Negative,Negative
648, The average price for a home around the catchment area of Oatley Public School also topped $1.4 million; after experiencing a 44.9 per cent lift in the past year,Negative,Negative,Negative,Negative
649, PRDnationwide agent Jack Huggett said given Oatley's public school was ranked number three on the Domain list it was popular with young families,Negative,Neutral,Neutral,Neutral
650," ""Some people were buying investment apartments in the area just to lock their children into the catchment area;"" he said",Negative,Neutral,Neutral,Neutral
651, He said buyers were also targeting school catchment zones in Sydney's northwest area,Neutral,Neutral,Neutral,Neutral
652," ""Private school fees are high and growing ahead of the inflation rate ",Positive,Neutral,Negative,Positive
653," sometimes it's not possible to do that and pay the fees so the alternative is public schools;"" he said",Neutral,Neutral,Positive,Neutral
654, In January; modelling by the Australian Scholarships Group found the cost of sending a child living in Sydney through private schooling would top $541;275 per child,Negative,Neutral,Neutral,Neutral
655,"  Nine Digital Pty Ltd 2019 A Property Report Reveals """"",Negative,Neutral,Negative,Negative
656,9 per cent increase over the last 12 months,Neutral,Neutral,Neutral,Neutral
657, Real estate agents sold 798 houses and 41 units for a sales total of 839 properties in the rolling year to November 2018,Negative,Positive,Neutral,Negative
658, Real Estate Institute of NSW Orana Division president Adam Wells said the Dubbo housing market continues to be a source of positivity,Neutral,Neutral,Neutral,Neutral
659, There is a real strength in our housing market and we have been able to sustain ourselves for an extended period now; he said,Positive,Positive,Positive,Positive
660, That is thanks to established agents and a stable economy in Dubbo for the last 15 to 20 years,Positive,Positive,Negative,Positive
661, We have capital cities and other regional areas performing below expectations and yet we see a consistent increase in Dubbo year on year; that is exciting,Positive,Positive,Positive,Positive
662, Mr Wells said Dubbo has a mixture of owneroccupiers and investors buying and a good number of firsthome buyers,Positive,Positive,Neutral,Positive
663, We are still seeing a number of firsthome buyers coming into the market which is good; he said,Positive,Positive,Positive,Positive
664, Just last week I sold a house to a 25yearold who had done all his homework and even with new lending criteria on the back of the royal commission still was able to buy his first home,Negative,Neutral,Negative,Negative
665, Dubbo is a Positive place to buy a home in and invest in,Positive,Neutral,Positive,Positive
666, We are encouraging all house purchases to take steps to get ready; so they are in the best position to secure a property,Positive,Positive,Neutral,Positive
667, Dubbo real estate agent Bob Berry said the figures are good news for homeowners,Positive,Positive,Neutral,Positive
668, Dubbo is holding up very well in the face of the constant claims of falling house prices; he said,Positive,Negative,Positive,Positive
669, Some claims indicate Australian house prices have fallen 4.5 per cent in the year; well; not in Dubbo,Negative,Negative,Neutral,Negative
670, Our market in Dubbo is performing well against the capital cities of Sydney and Melbourne,Negative,Positive,Positive,Positive
671, There is no one Australia house market;it has never been clearer how different circumstances impact differently on different markets,Negative,Neutral,Negative,Negative
672, Bondi Beach increased 16.7 per cent; but Bondi Junction declined by 11.6 per cent; so you couldn't get a better example of how you can cant describe the Australian housing market in a sweeping statement because those two suburbs are right next to each other,Negative,Neutral,Negative,Negative
673, In Orange the median house price is $397;000; up 7.5% over the last 12 months; Mudgees median price is $395;000; up 3.6 per cent; and Wellingtons median house price is $155;000 up 3.3 per cent,Negative,Neutral,Neutral,Neutral
674,Real Estate Institute of NSW Orana Division president Adam Wells said Dubbo's housing market is showing consistent increases,Negative,Positive,Neutral,Negative
675, Photo: CRAIG THOMSON,Neutral,Neutral,Neutral,Neutral
676, Dubbo has bucked the trend of falling house prices in Sydney and Melbourne and has registered a recordbreaking median house price of $367;00 which is a 1.9 per cent increase over the last 12 months,Negative,Negative,Negative,Negative
677, Real estate agents sold 798 houses and 41 units for a sales total of 839 properties in the rolling year to November 2018,Negative,Positive,Neutral,Negative
678, Real Estate Institute of NSW Orana Division president Adam Wells said the Dubbo housing market continues to be a source of positivity,Neutral,Neutral,Neutral,Neutral
679, There is a real strength in our housing market and we have been able to sustain ourselves for an extended period now; he said,Positive,Positive,Positive,Positive
680, That is thanks to established agents and a stable economy in Dubbo for the last 15 to 20 years,Positive,Positive,Negative,Positive
681, ALSO READ Central West rental report; December 2018 quarter ALSO READ Its more expensive to rent a house in Dubbo now than 12 months agowe tell you why ALSO READ Aerators are a BandAid solution to the problem; Angler and Healthy River Ambassador say We have capital cities and other regional areas performing below expectations and yet we see a consistent increase in Dubbo year on year; that is exciting,Neutral,Neutral,Positive,Neutral
682, Mr Wells said Dubbo has a mixture of owneroccupiers and investors buying and a good number of firsthome buyers,Positive,Positive,Neutral,Positive
683, We are still seeing a number of firsthome buyers coming into the market which is good; he said,Positive,Positive,Positive,Positive
684, Just last week I sold a house to a 25yearold who had done all his homework and even with new lending criteria on the back of the royal commission still was able to buy his first home,Negative,Neutral,Negative,Negative
685, Dubbo is a Positive place to buy a home in and invest in,Positive,Neutral,Positive,Positive
686, We are encouraging all house purchases to take steps to get ready; so they are in the best position to secure a property,Positive,Positive,Neutral,Positive
687, Dubbo real estate agent Bob Berry said the figures are good news for homeowners,Positive,Positive,Neutral,Positive
688, Dubbo is holding up very well in the face of the constant claims of falling house prices; he said,Positive,Negative,Positive,Positive
689, Some claims indicate Australian house prices have fallen 4.5 per cent in the year; well; not in Dubbo,Negative,Negative,Neutral,Negative
690, Our market in Dubbo is performing well against the capital cities of Sydney and Melbourne,Negative,Positive,Positive,Positive
691, There is no one Australia house market;it has never been clearer how different circumstances impact differently on different markets,Negative,Neutral,Negative,Negative
692, Bondi Beach increased 16.7 per cent; but Bondi Junction declined by 11.6 per cent; so you couldn't get a better example of how you can cant describe the Australian housing market in a sweeping statement because those two suburbs are right next to each other,Negative,Neutral,Negative,Negative
693, In Orange the median house price is $397;000; up 7.5% over the last 12 months; Mudgees median price is $395;000; up 3.6 per cent; and Wellingtons median house price is $155;000 up 3.3 per cent,Negative,Neutral,Neutral,Neutral
694, Love local news,Neutral,Positive,Positive,Positive
695,"As Master of the Royal Mint; he helped reform England's currency; the pound sterling; clamped down on counterfeiting and; in 1717; accidentally moved Britain to its first ever gold standard""",Negative,Positive,Neutral,Negative
696, His record as an investor; however; wasn't quite so illustrious,Negative,Neutral,Positive,Negative
697, Newton lost a fortune  around 20;000 pounds  in one of history's most notorious market collapses; the South Sea Bubble; when the South Sea Company; primarily a slave trader; collapsed in 1720,Negative,Negative,Negative,Negative
698, If only he'd remembered his early work as a physicist and applied his revolutionary theories on gravity to markets,Neutral,Positive,Negative,Neutral
699, In an eerie parallel; Australian real estate; particularly in Sydney and Melbourne; now appears to be succumbing to Newton's third law; that for every action; there is an equal and opposite reaction,Negative,Neutral,Negative,Negative
700, What goes up; must come down,Neutral,Negative,Negative,Negative
701,Infographic: National housing prices continue to decline,Positive,Neutral,Neutral,Neutral
702, (Supplied)Last week; Sydney's property market experienced its 12th straight month of declines while falls in Melbourne accelerated; sparked a flurry of warnings of impending doom,Negative,Negative,Negative,Negative
703, The question now is: will the housing bubble deflate or burst,Positive,Positive,Negative,Positive
704, The good Aussie real estate has endured prolonged periods of decline before,Negative,Positive,Positive,Positive
705, The two most severe; in the early 1890s and the 1930s were associated with severe global recession,Negative,Neutral,Negative,Negative
706, The recovery was long and painful,Negative,Negative,Negative,Negative
707,Not if; but by how muchHousing forecasts have gone from disagreement over whether home prices will fall to debates about how much they'll decline,Negative,Negative,Negative,Negative
708,But there have been plenty of other periods where domestic property prices have dropped significantly without causing a broader economic Armageddon,Negative,Positive,Positive,Positive
709, In fact; since 1980; we've endured at least half a dozen such downturns,Positive,Neutral,Negative,Positive
710, Those declines generally have been modest  less than 10 per cent  and followed significant price gains,Negative,Neutral,Neutral,Neutral
711, Effectively; they were blips or plateaus in a long and steady climb and most were caused by a jump in interest rates,Negative,Neutral,Negative,Negative
712, The Federal Government and the Reserve Bank both are praying for a similar result this time,Negative,Neutral,Neutral,Neutral
713, There's some evidence to back up their optimism,Positive,Neutral,Positive,Positive
714, Here's a brief list: The global economy; led by the US; is strengthening Local employment; a key factor; has been strong Our economic growth has been surprisingly good; jumping to 3.4 per cent in the June quarter Our dollar;,Positive,Positive,Negative,Positive
715, currently threatening to slide below $US0.70; ,Negative,Negative,Negative,Negative
716,has been a potent force in protecting the Australian economy And there is virtually no prospect of the Reserve Bank raising interest rates for at least another year,Negative,Negative,Positive,Negative
717, The bad We are now a full year into what so far has been an orderly correction; delivering what many Australians were demanding: more affordable housing,Negative,Positive,Neutral,Negative
718, That's a decent period of time,Positive,Positive,Neutral,Positive
719, But still the declines continue and there is every reason to expect they will fall further for an extended period,Negative,Negative,Negative,Negative
720," Investment bank Morgan Stanley; like many forecasters; reckons we will see falls of 10 per cent; as a base case""",Negative,Neutral,Neutral,Neutral
721, For the most part; the decline is being driven by credit restrictions,Neutral,Negative,Negative,Negative
722, Less available cash for borrowers means less demand for housing,Neutral,Neutral,Positive,Neutral
723, That means lower prices,Neutral,Neutral,Neutral,Neutral
724, And the man bearing the brunt of the ire from the real estate and financial world is Kenneth Hayne,Neutral,Neutral,Positive,Neutral
725,New home buyers' credit crunchHome buyers could see their borrowing capacity cut by as much as 40pc due to reforms likely to be driven by the Hayne Royal CommissionThere's no doubt the Royal Commission into Banking Misconduct has caused a wholesale rethink within the industry as lax and irresponsible lending practices have been jettisoned,Negative,Negative,Negative,Negative
726, That can only be a good thing,Positive,Neutral,Negative,Positive
727, The blame for our current situation should be sheeted home to those who turned a blind eye to the rotten state of Australian banking; not those who have attempted to clean it up,Negative,Negative,Negative,Negative
728, The east coast housing construction boom was created by a Reserve Bank keen to ward off an economic slowdown as the mining construction boom in the west rapidly wound down,Negative,Negative,Negative,Negative
729, As rates were slashed; it refused to restrain real estate through macroprudential controls; opting to let the property boom rip,Negative,Negative,Negative,Negative
730, The end result,Neutral,Neutral,Neutral,Neutral
731, Five years of profligate lending that has Australian households vying for top place as the world's most indebted ; at 130 per cent of GDP and 200 per cent of household income,Negative,Positive,Negative,Negative
732, Most of that borrowed cash was poured into real estate,Negative,Neutral,Neutral,Neutral
733, Australians have been able to keep on top of such a potentially punishing debt burden simply because interest rates have been at record lows,Positive,Neutral,Negative,Positive
734, But that tide is turning,Neutral,Positive,Neutral,Neutral
735, While the Reserve Bank has no plans to raise domestic rates any time soon; it may be overtaken by global events,Negative,Neutral,Neutral,Neutral
736, The US has raised rates eight times in the past few years,Neutral,Neutral,Neutral,Neutral
737, It raised them again a fortnight ago and another is likely before year end,Negative,Neutral,Neutral,Neutral
738, Our major banks all borrow offshore,Neutral,Neutral,Negative,Neutral
739, They will continue to pass on those higher costs; regardless of Reserve Bank movements; just as they did recently,Negative,Neutral,Negative,Negative
740, That doesn't bode well for Australian households,Negative,Negative,Negative,Negative
741, The ugly The biggest threat to our housing market is unemployment,Negative,Negative,Negative,Negative
742, Employment growth until now has been solid and; so far; there's been only a modest uptick in loan delinquencies; concentrated for the most part in the mining states of Western Australia and Queensland,Negative,Neutral,Neutral,Neutral
743, But what happens if the downturn in east coast property prices brings the housing construction boom to a shuddering halt,Neutral,Positive,Neutral,Neutral
744, Undoubtedly; there will be a large spike in unemployment,Neutral,Positive,Negative,Neutral
745, And that means increased housing loan defaults and further pressure on real estate following forced sales,Negative,Neutral,Neutral,Neutral
746, In that scenario; housing prices nationally would certainly fall well below the 10 per cent decline for which most are hoping; leaving many who bought a home in the past two years with debts greater than the value of their property,Negative,Neutral,Negative,Negative
747,Infographic: Building approvals of houses and apartments,Positive,Positive,Neutral,Positive
748, (Supplied)Those fears were fanned late last week when building approvals for July crashed 9.4 per cent; led by a sharp drop in unit approvals,Negative,Positive,Negative,Negative
749, As a monthly number; the statistics are highly volatile,Positive,Neutral,Neutral,Neutral
750, But there's no doubting the trend is down,Negative,Positive,Neutral,Negative
751, Developers; fearing a worsening glut; clearly have begun to scale back their plans,Negative,Negative,Negative,Negative
752, That's not surprising; given apartments overtook standalone houses for the first time in 2014 as the construction frenzy gathered pace,Negative,Negative,Negative,Negative
753, That glut; according to Morgan Stanley; is likely to persist for several more years which alone would keep pressure on prices,Negative,Negative,Negative,Negative
754,Infographic: The likelihood of a substantial housing surplus continuing despite a decline in construction,Neutral,Negative,Negative,Negative
755, (Supplied)The other great unknown is the extent to which investors will dump properties if prices continue to slide,Negative,Neutral,Neutral,Neutral
756, At the peak; investor loans made up nearly half of all property lending,Neutral,Neutral,Negative,Neutral
757, That's now collapsed with tighter restrictions on interestonly loans,Neutral,Negative,Negative,Negative
758,Infographic: The stepup in interest only borrowing occurred over 201315,Negative,Neutral,Neutral,Neutral
759, (Supplied)Unlike homeowners; who will do almost anything to keep a roof over their heads even if they are unemployed; investors are more likely to be motivated by a desire to minimise losses,Negative,Neutral,Negative,Negative
760, So far; that has not occurred,Negative,Neutral,Negative,Negative
761, But a sustained drop in prices could become a Negative feedback loop as investors bail out,Negative,Neutral,Negative,Negative
762, According to Wayne Byers; the head of the banking regulator APRA; if the worst case scenario unfolds and prices drop as much as 35 per cent; its stress testing shows the banking system will remain intact; although individual banks will incur heavy losses,Negative,Negative,Negative,Negative
763," ""Credit growth appears to be slowing somewhat at the moment but that is not surprising in an environment of softening house prices and rising interest rates;"" he told an Australian Business Economists gathering in an upbeat speech back in July",Negative,Negative,Neutral,Negative
764, Let's hope his faith in our banks is on more solid ground than the Royal Commissioner's confidence is in APRA's ability to regulate them,Neutral,Positive,Positive,Positive
765, And it will set you back the same amount or less than that city pad,Positive,Neutral,Negative,Positive
766, In fact; new site The Earth Awaits makes the whole process so much easier by showing you exactly what your budget can buy you around the world,Positive,Positive,Positive,Positive
767,Keep clicking for some dream international realty,Neutral,Positive,Neutral,Neutral
768,Photography Hutch and Hutch 2 of 8 Four bed new build; Spain; $707;000 Sunshine and blue seas a prerequisite,Negative,Neutral,Neutral,Neutral
769, This architecturallydesigned villa is on the Spanish coast,Neutral,Positive,Neutral,Neutral
770, There's a pool; terrace and solarium,Negative,Positive,Neutral,Negative
771, Buy off plan for $707;000 with Modern Spanish Homes ,Negative,Positive,Neutral,Negative
772,Photography Modern Spanish Homes 3 of 8 One bed flat; London; $706;000 If it's period features you're after; then this converted Victorian house in London's soughtafter Islington is on the market with Portico ,Negative,Positive,Neutral,Negative
773, You'll get change from $1m (it's priced at $706;000); but there's just one bedroom,Negative,Negative,Positive,Negative
774,Photography Portico 4 of 8 Four bed apartment; Mexico; $1.4m Yes it's a couple of hundred thousand over budget; but how dreamy is this place,Negative,Neutral,Negative,Negative
775, Perched on the Bay of Banderos between the white sandy beach and tropical jungle; this apartment has full access to the local beach club,Negative,Positive,Positive,Positive
776, That means a gym; spa and bar and grill on your doorstep,Positive,Positive,Negative,Positive
777, For more; head to Right Move ,Neutral,Neutral,Neutral,Neutral
778,Photography Right Move 5 of 8 Two bed ski apartment; France; $999;000 How about a seriously chic ski hideaway in the French Alps,Negative,Neutral,Neutral,Neutral
779, This impeccably designed 80 squaremetre apartment boasts uninterrupted views of Mont Blanc from the balcony,Negative,Positive,Positive,Positive
780, Buy through Leggett ,Neutral,Neutral,Neutral,Neutral
781,Photography Leggett 6 of 8 One bed apartment; New York; $1;000;000 Okay; so this onebed flat might not look like much from the outside; but the bright and airy interiors are to die for,Negative,Positive,Positive,Positive
782, Plus; it's in trendy Greenwich Village; has breathtaking views of the skyline and is steeped in history as a classic prewar hotel designed by Emery Roth,Negative,Positive,Positive,Positive
783, On the market with Bouklis Group ,Neutral,Neutral,Neutral,Neutral
784,Photography Bouklis Group 7 of 8 Eight bed house; South Africa; $940;000 Make your dream home pay for itself! This fully functional BB in the Western Cape has five ensuite apartments that you can rent out,Negative,Positive,Positive,Positive
785, Right Move has all the details,Positive,Neutral,Neutral,Neutral
786,Photography Right Move,Neutral,Positive,Neutral,Neutral
787,"AustraliaWeaker house prices and the fallout from the banking royal commission will mean 2019 will be a weak year for jobs in the finance; construction; real estate and retail sectors; economists have warned""",Negative,Neutral,Negative,Negative
