id,sentence,sentiment_Stanford,sentiment_Google Cloud,sentiment_Monkey Learn,Grand Truth
1101,Real estate agent's shock find at Telarah: RAAF investigate 'unexploded ordnance' Jessica Brown Court and Crime facebook SHARE twitter TWEET email whatsapp EXAMPLES: Unexploded ordnance and old military items could look like one of these,Negative,Positive,Negative,Negative
1102, The public has been warned not to touch unexploded ordnance and contact authorities immediately,Negative,Negative,Negative,Negative
1103, A REAL estate agent was inspecting a vacant property at Telarah on Wednesday when they made a shock discovery,Negative,Neutral,Neutral,Neutral
1104, Left inside the house on BrooksStreet was a motorbike and an unmarked box,Negative,Neutral,Negative,Negative
1105, The agent suspected the motorbike to be stolen and was about to contact police; when they looked inside the box and found what was initially thought to be unexploded ordnance,Neutral,Negative,Neutral,Neutral
1106, Unexploded ordnanceis any sort of military ammunition or explosive which has failed to function as intended,Negative,Negative,Negative,Negative
1107,If disturbed; they may explode without warning,Negative,Negative,Neutral,Negative
1108, Emergency services were called to the scene at Telarah and specialist teams from RAAF base Williamtown setup an exclusion zone,Negative,Neutral,Neutral,Neutral
1109, Precautions were taken to ensure the safety of residents until the contents of the box could be properly examined,Neutral,Negative,Negative,Negative
1110, The suspected explosives ended up being empty shells and the box was safely removed from the premises,Negative,Negative,Negative,Negative
1111, Police also seized the motorbike for further examination,Neutral,Neutral,Neutral,Neutral
1112, This is not the first time old military items have been found in the Hunter,Negative,Neutral,Negative,Negative
1113, In 2018a man and a young girl received shrapnel wounds when ordnance they found at the beach exploded in their Anna Bay home,Positive,Positive,Negative,Positive
1114," The incident prompted Hunter police to warn people not to touch ""rusty old metal"" on the beach",Neutral,Negative,Negative,Negative
1115, In 2017 aSydney family was lucky to have returned home from a weekend at Anna Bay in one piece after unknowingly playing a risky game of fetch with their dogs,Negative,Negative,Positive,Negative
1116, Dennis Spring and his daughters; Mischa; 17; and Shenandoah; 12; were exploring the Birubi sand dunes when their dogs Peppah and Brixton began playing fetch with what looked like an old car part,Negative,Positive,Negative,Negative
1117, It turned out; however; to be an unexploded WWII mortar,Neutral,Neutral,Negative,Neutral
1118, Peppah with her Birubi sand dunes find  an unexploded WWII mortar  on Saturday; August 26; 2017,Negative,Neutral,Neutral,Neutral
1119, Follow these simple actions if youfind a similarsuspicious item: DO NOT TOUCH; disturb or tamper with the item in any way,Negative,Neutral,Negative,Negative
1120, This includes making any attempt to move the item to a 'safe' location,Neutral,Negative,Negative,Negative
1121, Carefully note the appearance of the item and the location,Neutral,Neutral,Positive,Neutral
1122, Take a photograph if it is possible to do so without further approaching or disturbing the item,Neutral,Negative,Negative,Negative
1123, If possible; mark the location so that it can be found later,Neutral,Neutral,Neutral,Neutral
1124, Coloured tape or paint make easily recognised marker material,Negative,Neutral,Neutral,Neutral
1125, Note the route to the item,Neutral,Neutral,Neutral,Neutral
1126, Inform the property owner; park ranger; prime contractor; site foreman or supervisor of the find,Negative,Neutral,Negative,Negative
1127, Inform the Police that a possible ammunition item has been found,Neutral,Neutral,Neutral,Neutral
1128, They will instigate a request for Defence personnel to attend and dispose of the item,Negative,Positive,Negative,Negative
1129, While you're with us; did you know The Herald is now offering breaking news alerts; daily email newsletters and more,Neutral,Negative,Negative,Negative
1130, Keep uptodate with all the local news  sign up here,Neutral,Positive,Positive,Positive
1131, facebook SHARE twitter TWEET email whatsapp Follow us Local Business View More View More Local Businesses Local Business View More View More Local Businesses Local News Greg Piper slams Eraring Power Station owner in first parliament speech Man pleads guilty to negligent driving after crash blocks train line Paramedics have treated a pregnant woman after a crash at Kotara The Small Ballroom finds new home at 48 Watt Street Prepoll voting period could face review Port Stephens Eggs recalled due to potential salmonella contamination Sign up Please enter a valid email address Sign up to receive our Breaking News Alerts and Editor's Daily Headlines featuring the best local news and stories,Negative,Negative,Negative,Negative
1132," Privacy Policy Terms and Conditions Local News Greg Piper slams Eraring Power Station owner in first parliament speech Man pleads guilty to negligent driving after crash blocks train line Paramedics have treated a pregnant woman after a crash at Kotara The Small Ballroom finds new home at 48 Watt Street Prepoll voting period could face review Port Stephens Eggs recalled due to potential salmonella contamination Follow us Subscribe Share via Email Share on Facebook Share on Twitter RSS Feed Australian Community Media Privacy Policy Terms  Conditions  Digital Terms  Conditions  Newspaper Newcastle Herald Sitemap Contact Us About Us Group Subscriptions Gift Subscriptions Advertise With Us Digital Print Edition Help Center Shop Classifieds OneFlare Business Listings Place an Ad Classifieds  Notices Cars Jobs Domain Tributes Celebrations AgTrader Submit Letters to the Editor Send us your news"""",1,Negative
NULL,NULL,AustraliaWith Australia's population topping 25 million this year; our major cities are not just spreading out; they're also stepping up""",Negative,Negative,Negative,Negative
1133, Construction cranes have become a permanent feature of the urban landscape as developers compete to build more apartment and office towers and governments play catchup with infrastructure,Neutral,Positive,Positive,Positive
1134, The latest edition of the RLB Crane Index shows that crane numbers in Australia have hit an alltime high of 735; up from 684 at the last count,Positive,Negative,Neutral,Positive
1135, Sydney retains its mantle as crane capital of Australia; but has recorded a net loss of 21 cranes  by far the biggest drop in the survey,Negative,Neutral,Negative,Negative
1136, Other urban centres are taking up the slack; including the Central Coast; just north of Sydney; which saw a net gain of 15 cranes,Negative,Neutral,Negative,Negative
1137, But the biggest mover was Melbourne,Negative,Neutral,Neutral,Neutral
1138, With the Victorian capital on track to become Australia's most populous city by 2030; the city recorded a net gain of 35 cranes,Negative,Neutral,Negative,Negative
1139,Infographic: National Crane Index; Q3; 2018 (ABC News)External Link: Chart of the day: National Crane IndexWhat should I read next,Negative,Neutral,Neutral,Neutral
1140, Melbourne to build miniCBDs to cope with the population boom Offtheplan apartment pain as property prices fall From skyscraper to 'plyscraper': Timber to challenge concrete and steel What's it like to live in our fastestgrowing suburb,Negative,Neutral,Negative,Negative
1141, Want more charts,Neutral,Positive,Neutral,Neutral
1142, This is part of a new daily series featuring charts which tell a story ,Neutral,Positive,Neutral,Neutral
1143, If you know of some data that fits the bill; we'd love to hear about it ,Positive,Positive,Neutral,Positive
1144, House prices are slipping; and we're not alone in that The most manly (and womanly) jobs in Australia How bolshie are Australian workers in an era of stagnant wage growth,Negative,Neutral,Positive,Negative
1145,"ImageTasmanian Liberal politician Adam Brooks has a bit on his plate""",Positive,Neutral,Negative,Positive
1146,He may not be allowed a ministry; but Liberal MP Adam Brooks has a healthy portfolio when it comes to property,Negative,Neutral,Positive,Negative
1147, Members of the Tasmanian House of Assembly declared their interests as required annually under the Parliamentary (Disclosure of Interests) Act,Negative,Positive,Neutral,Negative
1148, Memberships of airline VIP lounges; racehorses; tickets to sporting events; wine and properties have featured on the register,Negative,Neutral,Positive,Negative
1149, Mr Brooks; who resigned as a government minister more than two years ago; declared interest in eight properties  four at Port Sorell; one at Penguin; one at Devonport and two interstate,Negative,Neutral,Negative,Negative
1150, He also declared he was director of eight corporations and patron or vicepatron of 12; including the RSL at Latrobe and Burnie; and the Vietnam Veterans Association in Tasmania,Negative,Neutral,Neutral,Neutral
1151, Mr Brooks resigned as mining minister in 2016 after it was found his consulting company; Maintenance Systems Solutions Pty Ltd; was active in the mining industry,Negative,Neutral,Negative,Negative
1152, Mr Brooks still has shares in the company; along with Total Performance Sports Pty Ltd; Rapid Fleet Management Pty Ltd and LAD Developments,Negative,Positive,Neutral,Negative
1153, 'A number of racehorses' Most of the Liberal team declared free access to Virgin and Qantas VIP lounges; as did Greens Leader Cassy O'Connor,Negative,Neutral,Neutral,Neutral
1154, Premier Will Hodgman declared he was either patron or ambassador for more than a dozen associations; including the Tasmanian Olympic Council; Variety Tasmania and the Sandy Bay Regatta Association,Negative,Neutral,Neutral,Neutral
1155, While he scored free tickets to the AFL grand final and the Melbourne Cup; cabinet colleagues Elise Archer and Treasurer Peter Gutwein had to settle for seats at the Big Bash cricket,Negative,Positive,Negative,Negative
1156, The Premier also declared being gifted Chinese tea; a bottle of Penfolds wine and a membership to the Tasmanian Racing Club,Negative,Positive,Positive,Positive
1157," Labor MP Scott Bacon also had a racing interest; declaring shares in a number of racehorses""",Positive,Neutral,Neutral,Neutral
1158, Deputy Premier Jeremy Rockliff declared patronage of 10 associations; with Health Minister Michael Ferguson busy with eight; several of them community associations at Lilydale,Negative,Neutral,Neutral,Neutral
1159, Fellow Liberal MP Mark Shelton declared interest in seven properties; while the speaker of the house Sue Hickey had interest in three; including her home at Rosetta,Negative,Neutral,Negative,Negative
1160, Roger Jaensch declared shares in Wesfarmers; Woolworths and the Commonwealth Bank of Australia,Negative,Neutral,Neutral,Neutral
1161, Labor newcomer Ella Haddad declared her spouse had shares in around 40 corporations,Neutral,Neutral,Neutral,Neutral
1162,All DUBBO median house prices have increased by 5.3 per cent in the past year; with experts saying the recent rain a Positive indicator for the market moving forward,Positive,Negative,Positive,Positive
1163, Orana Real Estate Institute chairperson Adam Wells said the figures released in the Domain House Price Report for September 2018; were good for Dubbo,Negative,Neutral,Neutral,Neutral
1164, These figures show more competitive pricing in the region; and the recent rain is an indicator that there is more positivity in the market,Negative,Positive,Positive,Positive
1165, People are also understanding a little more what the banks are needing in terms of lending with the royal commission going through; so it means people can move forward with their loans,Positive,Positive,Neutral,Positive
1166, Mr Wells said the spring season was also a good time to sell property in Dubbo; though they havent seen a huge change in the number of properties around the town for sale yet,Positive,Positive,Positive,Positive
1167, The data from the September report showed Dubbos median increase was slightly lower than the increase seen in neighbouring city Orange; though higher than Bathurst,Negative,Negative,Negative,Negative
1168, The median cost of a home in Dubbo over the past year jumped from$350;000 to $368;700 (5.3 per cent); in Orange it increased from$370;000 to $399;000 (7.8 per cent); while in Bathurst the median cost increased fromBathurst $424;500 to $446;000 (5.1 per cent),Negative,Negative,Neutral,Negative
1169, Thecost of a home in Young; however; declined in the 12 months to September 2018; with a drop of 3.8 per cent from $265;000 to $255;000,Negative,Negative,Neutral,Negative
1170, Bathurst topped the list for the highest prices; with the average home setting people back $446;000; this was followed by Orange ($399;000); Dubbo ($368;700); Cowra ($260;000) and Young ($255;000),Negative,Negative,Neutral,Negative
1171, Growth during the past five years in all five locations was significant; data in theDomain House Price Reportshowed,Negative,Positive,Neutral,Negative
1172, Cowra experienced the biggest growth at 44.6 per cent; with the median cost of a home jumping from $179;750 to $260;000 in just five years,Positive,Neutral,Positive,Positive
1173, Bathurst came in second for highest growth; with the median house cost jumping 34 per cent; from $332;750 to $446;000,Negative,Neutral,Neutral,Neutral
1174, In Dubbo; median prices jumped 24.7 per cent; from $295;625 to $368;700;in Orange they rose 20.9 per cent from $330;000 to $399;000; while in Young they increased by 20.3 per cent from $212;000 to $255;000 during the fiveyear period,Negative,Neutral,Negative,Negative
1175, The Domain data also revealed the Sydney house market was continuing to shrink; with prices falling 3.1 per cent during the September quarter and 6.5 per cent during the year to $1;101;532,Negative,Negative,Neutral,Negative
1176, Domain senior research analystDr Nicola Powell said Sydney recorded the largest annual fall in house prices of the capitals,Negative,Neutral,Neutral,Neutral
1177, While this is the steepest annual fall in more than 20 years; it follows one of the largest price upswings on record; she said,Negative,Neutral,Positive,Negative
1178, Prices during the boom surged 89.1 per cent in the space of almost six years and since the peak in mid2017; prices have come back 8.1 per cent,Neutral,Neutral,Neutral,Neutral
1179, October 25 2018  5:24PM Dubbo house prices increase by 5.3 per cent according to September's Domain House Price Report Nadine Morton facebook SHARE twitter TWEET email whatsapp GOING UP: Regions house prices jump by up to $113;000 in just five years,Negative,Neutral,Neutral,Neutral
1180, Photo: FILE DUBBO median house prices have increased by 5.3 per cent in the past year; with experts saying the recent rain a Positive indicator for the market moving forward,Positive,Negative,Negative,Negative
1181, Orana Real Estate Institute chairperson Adam Wells said the figures released in the Domain House Price Report for September 2018; were good for Dubbo,Negative,Neutral,Neutral,Neutral
1182, These figures show more competitive pricing in the region; and the recent rain is an indicator that there is more positivity in the market,Negative,Positive,Positive,Positive
1183, People are also understanding a little more what the banks are needing in terms of lending with the royal commission going through; so it means people can move forward with their loans,Positive,Positive,Neutral,Positive
1184, Mr Wells said the spring season was also a good time to sell property in Dubbo; though they havent seen a huge change in the number of properties around the town for sale yet,Positive,Positive,Positive,Positive
1185, READ MORE: Open for inspection in Dubbo; October 2527 The data from the September report showed Dubbos median increase was slightly lower than the increase seen in neighbouring city Orange; though higher than Bathurst,Negative,Negative,Negative,Negative
1186, The median cost of a home in Dubbo over the past year jumped from$350;000 to $368;700 (5.3 per cent); in Orange it increased from$370;000 to $399;000 (7.8 per cent); while in Bathurst the median cost increased fromBathurst $424;500 to $446;000 (5.1 per cent),Negative,Negative,Neutral,Negative
1187, Thecost of a home in Young; however; declined in the 12 months to September 2018; with a drop of 3.8 per cent from $265;000 to $255;000,Negative,Negative,Neutral,Negative
1188, Bathurst topped the list for the highest prices; with the average home setting people back $446;000; this was followed by Orange ($399;000); Dubbo ($368;700); Cowra ($260;000) and Young ($255;000),Negative,Negative,Neutral,Negative
1189, Cowra experienced the biggest growth at 44.6 per cent; with the average cost of a home jumping from $179;750 to $260;000 in just five years,Positive,Neutral,Positive,Positive
1190, Domain House Price Report; September 2018 Growth during the past five years in all five locations was significant; data in theDomain House Price Reportshowed,Negative,Neutral,Neutral,Neutral
1191, Cowra experienced the biggest growth at 44.6 per cent; with the median cost of a home jumping from $179;750 to $260;000 in just five years,Positive,Neutral,Positive,Positive
1192, Bathurst came in second for highest growth; with the median house cost jumping 34 per cent; from $332;750 to $446;000,Negative,Neutral,Neutral,Neutral
1193,Open for inspection in Bathurst; October 2528 In Dubbo; median prices jumped 24.7 per cent; from $295;625 to $368;700;in Orange they rose 20.9 per cent from $330;000 to $399;000; while in Young they increased by 20.3 per cent from $212;000 to $255;000 during the fiveyear period,Negative,Negative,Neutral,Negative
1194, The Domain data also revealed the Sydney house market was continuing to shrink; with prices falling 3.1 per cent during the September quarter and 6.5 per cent during the year to $1;101;532.,Negative,Negative,Neutral,Negative
1195,Domain House Price Report; June 2018 Domain senior research analystDr Nicola Powell said Sydney recorded the largest annual fall in house prices of the capitals,Negative,Neutral,Neutral,Neutral
1196, While this is the steepest annual fall in more than 20 years; it follows one of the largest price upswings on record; she said,Negative,Neutral,Positive,Negative
1197, Prices during the boom surged 89.1 per cent in the space of almost six years and since the peak in mid2017; prices have come back 8.1 per cent,Neutral,Neutral,Neutral,Neutral
1198, Sydney is down and Melbourne prices have dropped even more,Negative,Negative,Positive,Negative
1199, The risk of buying right now is suddenly much higher,Negative,Negative,Negative,Negative
1200, We need a new set of rules,Neutral,Neutral,Neutral,Neutral
1201, What follows is a group of ideas to help you navigate this extremely unusual point in Australias housing market history,Negative,Neutral,Neutral,Neutral
1202, Rule 1: Dont buy now,Neutral,Negative,Negative,Negative
1203, It sounds obvious; but not everyone gets this,Negative,Negative,Positive,Negative
1204, If you can buy the same place for 10 per cent less next year; buying it this year is costing you money,Negative,Negative,Negative,Negative
1205, So long as the market is falling; you should stay cool and calm,Negative,Positive,Negative,Negative
1206, Wait for you moment to pounce,Neutral,Neutral,Negative,Neutral
1207, Rule 2: Dont wait for ever,Neutral,Positive,Negative,Neutral
1208, Markets fall for a while and then they turn up again,Negative,Neutral,Neutral,Neutral
1209, If you read a bit about the Australian housing market you know by now all the reasons why housing might be overvalued: low interest rates; high greed; insufficient supply; rapacious banks lending way too much; and the belief housing only ever goes up,Negative,Negative,Negative,Negative
1210, But dont forget there are a lot of balancing factors that will most likely prevent Australias housing market from having a crash in the style of Spain or Detroit:  First home buyers are on the sideline and they have been saving hard for years,Negative,Neutral,Positive,Negative
1211, Some big deposits are out there lurking  Chinese buyers are out there looking for options cheaper than; say; Canada  Banks can cut interest rates to help people borrow The RBA can cut rates if things get really bad  Our financial system is strong so even if prices drop; you cant expect a banking meltdown to accelerate the downturn like we saw in the US,Negative,Negative,Negative,Negative
1212, All this means a housing price fall in Australia is unlikely to become the extended; fiveyear; 40 per cent crash first home buyers dream of at night,Negative,Neutral,Neutral,Neutral
1213, Waiting too long can be more expensive as waiting too little,Negative,Negative,Negative,Negative
1214, Heres how to navigate a falling property market,Neutral,Negative,Neutral,Neutral
1215, Source:News Corp Australia Rule 3: You can never time the market perfectly,Neutral,Neutral,Neutral,Neutral
1216, Give up on it,Positive,Neutral,Negative,Positive
1217, Only one person buys at the absolute bottom,Neutral,Negative,Negative,Negative
1218, Getting a bit closer to the bottom than if you bought now is the best you can hope for,Positive,Positive,Positive,Positive
1219, Remember above when I said: So long as the market is falling; you should stay cool and calm,Neutral,Positive,Negative,Neutral
1220, The thing is that you never know what the market is doing right now,Negative,Neutral,Negative,Negative
1221, At best you know what it was doing last month,Positive,Positive,Neutral,Positive
1222, If it starts to turn up; it will be a while before you realise,Neutral,Negative,Positive,Neutral
1223, Also; there is an old principle in investing: time in the market beats timing the market,Negative,Neutral,Negative,Negative
1224, If you decide to wait and the prices start to rise while youre sorting the loan out with your bank; youll feel plenty of regret,Negative,Neutral,Negative,Negative
1225, (Youll notice that these rules need to be balanced off against each other,Negative,Neutral,Neutral,Neutral
1226, To be honest; theyre more like guidelines,Negative,Neutral,Negative,Negative
1227,) Rule 4: Do your research,Neutral,Neutral,Neutral,Neutral
1228, And not just online,Neutral,Neutral,Negative,Neutral
1229, You know the places that look so appealing on the real estate sites,Positive,Positive,Positive,Positive
1230, Lots of other people also think they look good,Positive,Positive,Positive,Positive
1231, Theyre probably beautifully presented; underpriced; or both,Positive,Positive,Positive,Positive
1232, There will be a lot of competition Dont rule out the ones that seem unappealing online,Negative,Negative,Negative,Negative
1233, Research puts you in a very strong position,Positive,Neutral,Positive,Positive
1234, The housing market is not perfectly harmonised,Negative,Neutral,Positive,Negative
1235, It is not like the market for biscuits at Coles where prices and products are uniform all the time,Negative,Neutral,Positive,Negative
1236, Some weekends; a house sells at a crazy high price; and some weekends a place sells at a crazy low price,Negative,Neutral,Neutral,Neutral
1237, Just because the market overall is doing one thing doesnt mean a particular house wont do something totally different,Negative,Neutral,Negative,Negative
1238, You can catch a bargain by paying really close attention,Neutral,Positive,Negative,Neutral
1239, Look at a lot of houses,Neutral,Positive,Neutral,Neutral
1240, Strike when you find a good one,Positive,Positive,Positive,Positive
1241, Rule 5: If you want to buy a house to live in now; buy a house to live in now,Negative,Neutral,Negative,Negative
1242, Say you will own a house for 20 years; one year is five per cent of that time,Positive,Positive,Negative,Positive
1243, If you buy now and the house loses five per cent of its value; just remember that you got a lot of value by living in a house of your very own for a year,Neutral,Neutral,Negative,Neutral
1244, Are you really that far behind,Positive,Neutral,Neutral,Neutral
1245, Rule 6: If you do buy now; dont obsessively read about property prices again for a couple of years,Neutral,Neutral,Negative,Neutral
1246, Beating yourself up for missing a drop in property prices will be totally unproductive,Negative,Neutral,Positive,Negative
1247, You can only make decisions with the info you have at the time,Negative,Neutral,Positive,Negative
1248, Most people buy at what seems like the wrong time,Neutral,Negative,Negative,Negative
1249, This week alone he's sold $45 million worth of property; he once sold a $11 million home to actor Tyler Perry in less than 10 hours ; and made a whopping $12 million sale a couple of hours after meeting someone in line at Starbucks,Negative,Neutral,Negative,Negative
1250, He's also sold one of the world's most expensive onebedroom houses in history at $20 million ,Negative,Neutral,Negative,Negative
1251, The onetime mail delivery guy turned multimillionaire investor and agent shares his best real estate tips with ninemsn homes ahead of his first Australian tour,Neutral,Positive,Negative,Neutral
1252," How to spot a good investment ""All the success I've had in real estate investment has always come from two different things; one is always buying in Aplus location; even if you have to pay a little more",Neutral,Positive,Negative,Neutral
1253, You'll always be able to sell a property in a premium location whenever you need to,Neutral,Positive,Positive,Positive
