sentence,sentiment
 SYDNEY Although Sydney retains the highest priced suburbs  with a $955;000 median house price  many are falling greater than anywhere else in Australia; with middle priced suburbs suffering the most and expensive suburbs holding up well,Negative
 Manly and Paddington are now some of the highest views per listing in NSW and are also clocking moderate price growth,Negative
 Prices have fallen 6.7 per cent in Sydney from the peak and there is the potential for another 5 per cent fall in the first half of the year,Negative
 MELBOURNE Melbournes performance is certainly a lot stronger than Sydney and while its been hit by the same finance restrictions; the Victorian capital seems to be supported by jobs growth,Negative
 It will take some time to get a clear read on what is happening with jobs; but the demand from renters in the city suggests jobs are being created and people are continuing to move to Melbourne,Negative
 The west is recorded the strongest growth; up 1.8 per cent yearonyear,Positive
 Despite Melbournes overall softening; regional Victoria is booming with Ballarat; Geelong and LaTrobeGippsland performing well,Negative
 BRISBANE Innercity Brisbane is defying the countrys downturn with prices up 2.2 per cent while some suburbs in Gold Coast are doing particularly well  Main Beach rose almost 30 per cent yearonyear and Currumbin is up more than 13 per cent,Negative
 CANBERRA Canberra is currently the second strongest market in Australia and will benefit from a change of prime minister as Labor Governments tend to employ more staff,Positive
 There will also be a high need for consultants in the early stages of transition,Positive
 With price growth at 1.35 per cent over the past 12 months; its unlikely these flat conditions will turn negative in the first half of 2019,Negative
 HOBART Two of the most in demand suburbs in Australia are in Hobart  Battery Point and South Hobart  and Carlton is moving quickly up the most popular list,Negative
 2017s quickest moving suburb; Margate; rose more than 18 per cent in 2018; double that for Hobart which suggests Carlton will outperform the market,Negative
 The city recorded its first $1 million suburb with Battery Point hitting $1.34 million,Negative
 Hobarts price growth is expected to continue this year,Negative
 PERTH The stopstart nature of Perths recovery appears to have stalled or declined; but suburbs within the city continue to perform strongly,Neutral
 Peppermint Grove; one of Australias most expensive suburbs; is still recording increases and West Perth rose almost 27 per cent,Negative
 The most in demand suburbs continue to show a mix of beachside (Cottesloe and City Beach); as well as inner West suburbs (Shenton Park),Positive
 DARWIN Like Perth; any recovery in Darwin is stopstart and was completely derailed by the royal commission; any improvements to financing will be a positive for this market,Negative
 While prices continue to fall; premium property is holding up,Neutral
 Fannie Bay is Darwins most expensive suburb and continues to record very high views per listing and double digit price growth,Positive
"Normal text size Larger text size Very large text size The median house in Perth has lost nearly $100;000 in value in the past five years; with suburbs in Mandurah and the eastern fringes hit the hardest by the drop; according to new figures""",Negative
 CoreLogic's March home value index report; released Monday; showed Perth had gone from being Australia's most expensive city to live in in 2006; to one of the cheapest in 2019  Perth property values have dropped; on average; by $100;000 in the past five years,Negative
 Credit: Arsineh Houspian The housing price plummet has allowed more first homebuyers to enter the market; but for sellers it has seen the value of the average Perth dwelling drop from $540;556 in 2014 to $442;716 in March 2019,Negative
 The downward trend is losing some of its steam; but CoreLogic predicts the 'bottomingout' of the housing market is yet to come,Negative
 Advertisement According to the report; Perth property values have dropped by 17.4 per cent in the past five years; by 7.7 per cent in the past year; 2.9 per cent in the past quarter; and by 0.4 per cent in the past month,Negative
 CoreLogic head of research Tim Lawless said areas in Perth's urban fringes had been hardest hit by the price drop,Negative
" Because it is a very affordable market now; we aren't really seeing that demand towards the medium to lower ends of the markets;"" he said",Negative
" ""There are signs WA's housing supply is now fairly in tune with demand and as a result rents are rising and housing is very affordable; we just need that magical ingredient of credit availability as well as stronger economic conditions to really unlock the marketplace",Positive
""" Banks tightened the rules around lending in mid2018 after it was revealed they frequently loaned homebuyers more than 40 per cent of their disposable income",Negative
 The changes mean it's harder for buyers to get access to credit,Neutral
 Mr Lawless said Perth's property market peaked in 2014 during the mining boom before beginning to decline on the back of softer commodity prices and an economic downturn,Negative
" ""From there we've started to see unemployment rising; jobs growth falling and migration rates moving into the negative  that is still somewhat the case; although it's not quite as severe as it used to be;"" he said",Negative
 REIWA president Damian Collins said despite the CoreLogic index showing a decline in Perth dwelling values; there were many suburbs that had improved in the month to March,Negative
" ""While dwelling values declined again in March; the rate of decline has slowed to the lowest level recorded since June 2018; which is a positive indication that prices in Perth may be approaching the bottom;"" he said",Negative
" ""REIWA data shows there were numerous suburbs that saw their median house price buck the declining trends; with 30 per cent of those statistically significant suburbs experiencing an increase in price and 15 per cent remaining stable; which is a positive trend in the current real estate environment",Negative
 The 10 bestperforming suburbs for median house price growth in March were Mullaloo; Wannanup; Lesmurdie; Alkimos; Karrinyup; Yanchep; Rivervale; Mount Pleasant; The Vines and Warnbro,Negative
 In regional WA; mining towns in the west Pilbara are beginning to recover from the pits of the mining bust; with housing values up 9.8 per cent on the past year; according to CoreLogic,Negative
 However the value is still 58 per cent down from its peak in 2012; when humble country homes were being sold for sevenfigure sums as mining companies scrambled to house their employees,Negative
 REIWA statistics show the Karratha suburbs of Bulgarra; Millars Well and Pegs Creek were the top three highest growth suburbs in WA in 2018,Negative
 Nationally; property values continued to decline to March; with Sydney and Melbourne's markets taking the biggest hit in the past 12 months; losing 10.8 per cent and 9.8 per cent value respectively,Positive
 Hobart; Canberra and Adelaide bucked the national trend; each recording an increase in property values,Positive
 Hobart experienced the highest level of growth; at six per cent; which Mr Lawless said was due to more eastern states residents seeking a treechange; or lifestyle property at an affordable price,Neutral
 License this article Property development Home loans Heather McNeill Facebook Twitter Email Heather McNeill covers breaking news with a focus on crime; courts and Aboriginal affairs for WAtoday,Negative
" Most Viewed in National Loading Advertisement The Age Twitter Facebook Instagram RSS Our Sites The Age The Sydney Morning Herald Brisbane Times WAtoday The Australian Financial Review Domain Traveller Good Food Executive Style The Store Drive RSVP Essential Baby Essential Kids Weatherzone Classifieds Tributes Celebrations Place your ad Commercial Real Estate Oneflare The Age Contact  support Advertise with us Newsletters Accessibility guide Sitemap Photo sales Purchase front pages Content licensing Our events Work with us Conditions of use Privacy policy Press Council Products  Services Subscription packages Subscriber benefits My account Subscriptions FAQs Today's Paper Copyright  2019 Feedback Subscribe"""",1,Negative
NULL,NULL,Supplied THE original home of The Echo newspaper in Ocean Grove has sold to a local family""",Neutral
 The buyers of 103 The Parade plan on building a family home on the site after securing it for a price within the asking range of $1 million to $1.1 million,Neutral
 Point Lonsdale agent Campbell Potts said there were two main players that were interested in the property at the end of the expressions of interest campaign,Neutral
 MORE REAL ESTATE:Local familys after auction offer secures dream home in Hamlyn Heights Whats next for Geelongs property market as lossmaking sales hits 16year low Modern builds attract top dollar in popular South Geelong John Townsend with an early edition of the Echo outside the house where it was founded in 1962,Negative
 Picture: Alan Barber Source:News Corp Australia Plans to build a family home was one of the reasons the vendors liked the successful buyer; Mr Potts said,Positive
 There was development potential for the 811sq m site within 200m of the town centre; subject to council approval,Negative
 The threebedroom character house was built in 1948 and was the original home of The Echo newspaper; that was initially a newsletter,Negative
 The property is in a central location,Neutral
 Source:Supplied The buyers plan on building a family home on the site,Neutral
 Source:Supplied Alix and John Townsend started the paper in 1962 and their son John bought out his siblings when his mum died in 2008,Negative
 Mr Townsend said it was a very busy household and all the local news was basically brought by people to the front door,Negative
 Why location is everything in real estate 1:58 Why location is everything in real estate September 10th 2018 4 months ago /display/newscorpaustralia,Negative
There was always something happening; people used to say if they wanted to know what was happening they would come to our house; he said,Negative
 Someone turned up with a fairy penguin one day that they had found and mum and dad knew someone that could help them out,Negative
 As the paper grew an office across the road was used to run the paper before the Geelong Advertiser eventually bought the newspaper 15 years after it started,Neutral
"The Domain 2015 School Zones Report has found catchment zones for some of the state's most sought after public schools has seen a significant increase in price during the past 12 months""",Negative
 Properties located near Strathfield Girls High School tops the list for secondary education; with 38.6 percent growth taking median property prices to $1.3 million,Negative
" Education is a growing part of the equation that can drive prices higher;"" Domain Group senior economist Dr Andrew Wilson said",Neutral
 The cost of homes in the school zone around Parramatta Public School rose by 56.5 percent to $1 million; while property close to Ashbury Public School rose by 46.6 percent to $1.4 million,Negative
 The average price for a home around the catchment area of Oatley Public School also topped $1.4 million; after experiencing a 44.9 per cent lift in the past year,Negative
 PRDnationwide agent Jack Huggett said given Oatley's public school was ranked number three on the Domain list it was popular with young families,Negative
" ""Some people were buying investment apartments in the area just to lock their children into the catchment area;"" he said",Negative
 He said buyers were also targeting school catchment zones in Sydney's northwest area,Neutral
" ""Private school fees are high and growing ahead of the inflation rate ",Positive
" sometimes it's not possible to do that and pay the fees so the alternative is public schools;"" he said",Neutral
 In January; modelling by the Australian Scholarships Group found the cost of sending a child living in Sydney through private schooling would top $541;275 per child,Negative
"  Nine Digital Pty Ltd 2019 A Property Report Reveals """"",Negative
9 per cent increase over the last 12 months,Neutral
 Real estate agents sold 798 houses and 41 units for a sales total of 839 properties in the rolling year to November 2018,Negative
 Real Estate Institute of NSW Orana Division president Adam Wells said the Dubbo housing market continues to be a source of positivity,Neutral
 There is a real strength in our housing market and we have been able to sustain ourselves for an extended period now; he said,Positive
 That is thanks to established agents and a stable economy in Dubbo for the last 15 to 20 years,Positive
 We have capital cities and other regional areas performing below expectations and yet we see a consistent increase in Dubbo year on year; that is exciting,Positive
 Mr Wells said Dubbo has a mixture of owneroccupiers and investors buying and a good number of firsthome buyers,Positive
 We are still seeing a number of firsthome buyers coming into the market which is good; he said,Positive
 Just last week I sold a house to a 25yearold who had done all his homework and even with new lending criteria on the back of the royal commission still was able to buy his first home,Negative
 Dubbo is a positive place to buy a home in and invest in,Positive
 We are encouraging all house purchases to take steps to get ready; so they are in the best position to secure a property,Positive
 Dubbo real estate agent Bob Berry said the figures are good news for homeowners,Positive
 Dubbo is holding up very well in the face of the constant claims of falling house prices; he said,Positive
 Some claims indicate Australian house prices have fallen 4.5 per cent in the year; well; not in Dubbo,Negative
 Our market in Dubbo is performing well against the capital cities of Sydney and Melbourne,Negative
 There is no one Australia house market;it has never been clearer how different circumstances impact differently on different markets,Negative
 Bondi Beach increased 16.7 per cent; but Bondi Junction declined by 11.6 per cent; so you couldn't get a better example of how you can cant describe the Australian housing market in a sweeping statement because those two suburbs are right next to each other,Negative
 In Orange the median house price is $397;000; up 7.5% over the last 12 months; Mudgees median price is $395;000; up 3.6 per cent; and Wellingtons median house price is $155;000 up 3.3 per cent,Negative
Real Estate Institute of NSW Orana Division president Adam Wells said Dubbo's housing market is showing consistent increases,Negative
 Photo: CRAIG THOMSON,Neutral
 Dubbo has bucked the trend of falling house prices in Sydney and Melbourne and has registered a recordbreaking median house price of $367;00 which is a 1.9 per cent increase over the last 12 months,Negative
 Real estate agents sold 798 houses and 41 units for a sales total of 839 properties in the rolling year to November 2018,Negative
 Real Estate Institute of NSW Orana Division president Adam Wells said the Dubbo housing market continues to be a source of positivity,Neutral
 There is a real strength in our housing market and we have been able to sustain ourselves for an extended period now; he said,Positive
 That is thanks to established agents and a stable economy in Dubbo for the last 15 to 20 years,Positive
 ALSO READ Central West rental report; December 2018 quarter ALSO READ Its more expensive to rent a house in Dubbo now than 12 months agowe tell you why ALSO READ Aerators are a BandAid solution to the problem; Angler and Healthy River Ambassador say We have capital cities and other regional areas performing below expectations and yet we see a consistent increase in Dubbo year on year; that is exciting,Neutral
 Mr Wells said Dubbo has a mixture of owneroccupiers and investors buying and a good number of firsthome buyers,Positive
 We are still seeing a number of firsthome buyers coming into the market which is good; he said,Positive
 Just last week I sold a house to a 25yearold who had done all his homework and even with new lending criteria on the back of the royal commission still was able to buy his first home,Negative
 Dubbo is a positive place to buy a home in and invest in,Positive
 We are encouraging all house purchases to take steps to get ready; so they are in the best position to secure a property,Positive
 Dubbo real estate agent Bob Berry said the figures are good news for homeowners,Positive
 Dubbo is holding up very well in the face of the constant claims of falling house prices; he said,Positive
 Some claims indicate Australian house prices have fallen 4.5 per cent in the year; well; not in Dubbo,Negative
 Our market in Dubbo is performing well against the capital cities of Sydney and Melbourne,Negative
 There is no one Australia house market;it has never been clearer how different circumstances impact differently on different markets,Negative
 Bondi Beach increased 16.7 per cent; but Bondi Junction declined by 11.6 per cent; so you couldn't get a better example of how you can cant describe the Australian housing market in a sweeping statement because those two suburbs are right next to each other,Negative
 In Orange the median house price is $397;000; up 7.5% over the last 12 months; Mudgees median price is $395;000; up 3.6 per cent; and Wellingtons median house price is $155;000 up 3.3 per cent,Negative
 Love local news,Neutral
"As Master of the Royal Mint; he helped reform England's currency; the pound sterling; clamped down on counterfeiting and; in 1717; accidentally moved Britain to its first ever gold standard""",Negative
 His record as an investor; however; wasn't quite so illustrious,Negative
 Newton lost a fortune  around 20;000 pounds  in one of history's most notorious market collapses; the South Sea Bubble; when the South Sea Company; primarily a slave trader; collapsed in 1720,Negative
 If only he'd remembered his early work as a physicist and applied his revolutionary theories on gravity to markets,Neutral
 In an eerie parallel; Australian real estate; particularly in Sydney and Melbourne; now appears to be succumbing to Newton's third law; that for every action; there is an equal and opposite reaction,Negative
 What goes up; must come down,Neutral
Infographic: National housing prices continue to decline,Positive
 (Supplied)Last week; Sydney's property market experienced its 12th straight month of declines while falls in Melbourne accelerated; sparked a flurry of warnings of impending doom,Negative
 The question now is: will the housing bubble deflate or burst,Positive
 The good Aussie real estate has endured prolonged periods of decline before,Negative
 The two most severe; in the early 1890s and the 1930s were associated with severe global recession,Negative
 The recovery was long and painful,Negative
Not if; but by how muchHousing forecasts have gone from disagreement over whether home prices will fall to debates about how much they'll decline,Negative
But there have been plenty of other periods where domestic property prices have dropped significantly without causing a broader economic Armageddon,Negative
 In fact; since 1980; we've endured at least half a dozen such downturns,Positive
 Those declines generally have been modest  less than 10 per cent  and followed significant price gains,Negative
 Effectively; they were blips or plateaus in a long and steady climb and most were caused by a jump in interest rates,Negative
 The Federal Government and the Reserve Bank both are praying for a similar result this time,Negative
 There's some evidence to back up their optimism,Positive
 Here's a brief list: The global economy; led by the US; is strengthening Local employment; a key factor; has been strong Our economic growth has been surprisingly good; jumping to 3.4 per cent in the June quarter Our dollar;,Positive
 currently threatening to slide below $US0.70; ,Negative
has been a potent force in protecting the Australian economy And there is virtually no prospect of the Reserve Bank raising interest rates for at least another year,Negative
 The bad We are now a full year into what so far has been an orderly correction; delivering what many Australians were demanding: more affordable housing,Negative
 That's a decent period of time,Positive
 But still the declines continue and there is every reason to expect they will fall further for an extended period,Negative
" Investment bank Morgan Stanley; like many forecasters; reckons we will see falls of 10 per cent; as a base case""",Negative
 For the most part; the decline is being driven by credit restrictions,Neutral
 Less available cash for borrowers means less demand for housing,Neutral
 That means lower prices,Neutral
 And the man bearing the brunt of the ire from the real estate and financial world is Kenneth Hayne,Neutral
New home buyers' credit crunchHome buyers could see their borrowing capacity cut by as much as 40pc due to reforms likely to be driven by the Hayne Royal CommissionThere's no doubt the Royal Commission into Banking Misconduct has caused a wholesale rethink within the industry as lax and irresponsible lending practices have been jettisoned,Negative
 That can only be a good thing,Positive
 The blame for our current situation should be sheeted home to those who turned a blind eye to the rotten state of Australian banking; not those who have attempted to clean it up,Negative
 The east coast housing construction boom was created by a Reserve Bank keen to ward off an economic slowdown as the mining construction boom in the west rapidly wound down,Negative
 As rates were slashed; it refused to restrain real estate through macroprudential controls; opting to let the property boom rip,Negative
 The end result,Neutral
 Five years of profligate lending that has Australian households vying for top place as the world's most indebted ; at 130 per cent of GDP and 200 per cent of household income,Negative
 Most of that borrowed cash was poured into real estate,Negative
 Australians have been able to keep on top of such a potentially punishing debt burden simply because interest rates have been at record lows,Positive
 But that tide is turning,Neutral
 While the Reserve Bank has no plans to raise domestic rates any time soon; it may be overtaken by global events,Negative
 The US has raised rates eight times in the past few years,Neutral
 It raised them again a fortnight ago and another is likely before year end,Negative
 Our major banks all borrow offshore,Neutral
 They will continue to pass on those higher costs; regardless of Reserve Bank movements; just as they did recently,Negative
 That doesn't bode well for Australian households,Negative
 The ugly The biggest threat to our housing market is unemployment,Negative
 Employment growth until now has been solid and; so far; there's been only a modest uptick in loan delinquencies; concentrated for the most part in the mining states of Western Australia and Queensland,Negative
 But what happens if the downturn in east coast property prices brings the housing construction boom to a shuddering halt,Neutral
 Undoubtedly; there will be a large spike in unemployment,Neutral
 And that means increased housing loan defaults and further pressure on real estate following forced sales,Negative
 In that scenario; housing prices nationally would certainly fall well below the 10 per cent decline for which most are hoping; leaving many who bought a home in the past two years with debts greater than the value of their property,Negative
Infographic: Building approvals of houses and apartments,Positive
 (Supplied)Those fears were fanned late last week when building approvals for July crashed 9.4 per cent; led by a sharp drop in unit approvals,Negative
 As a monthly number; the statistics are highly volatile,Positive
 But there's no doubting the trend is down,Negative
 Developers; fearing a worsening glut; clearly have begun to scale back their plans,Negative
 That's not surprising; given apartments overtook standalone houses for the first time in 2014 as the construction frenzy gathered pace,Negative
 That glut; according to Morgan Stanley; is likely to persist for several more years which alone would keep pressure on prices,Negative
Infographic: The likelihood of a substantial housing surplus continuing despite a decline in construction,Neutral
 (Supplied)The other great unknown is the extent to which investors will dump properties if prices continue to slide,Negative
 At the peak; investor loans made up nearly half of all property lending,Neutral
 That's now collapsed with tighter restrictions on interestonly loans,Neutral
Infographic: The stepup in interest only borrowing occurred over 201315,Negative
 (Supplied)Unlike homeowners; who will do almost anything to keep a roof over their heads even if they are unemployed; investors are more likely to be motivated by a desire to minimise losses,Negative
 So far; that has not occurred,Negative
 But a sustained drop in prices could become a negative feedback loop as investors bail out,Negative
 According to Wayne Byers; the head of the banking regulator APRA; if the worst case scenario unfolds and prices drop as much as 35 per cent; its stress testing shows the banking system will remain intact; although individual banks will incur heavy losses,Negative
