sentence,sentiment
" ""Credit growth appears to be slowing somewhat at the moment but that is not surprising in an environment of softening house prices and rising interest rates;"" he told an Australian Business Economists gathering in an upbeat speech back in July",Negative
 Let's hope his faith in our banks is on more solid ground than the Royal Commissioner's confidence is in APRA's ability to regulate them,Neutral
 And it will set you back the same amount or less than that city pad,Positive
 In fact; new site The Earth Awaits makes the whole process so much easier by showing you exactly what your budget can buy you around the world,Positive
Keep clicking for some dream international realty,Neutral
Photography Hutch and Hutch 2 of 8 Four bed new build; Spain; $707;000 Sunshine and blue seas a prerequisite,Negative
 This architecturallydesigned villa is on the Spanish coast,Neutral
 There's a pool; terrace and solarium,Negative
 Buy off plan for $707;000 with Modern Spanish Homes ,Negative
Photography Modern Spanish Homes 3 of 8 One bed flat; London; $706;000 If it's period features you're after; then this converted Victorian house in London's soughtafter Islington is on the market with Portico ,Negative
 You'll get change from $1m (it's priced at $706;000); but there's just one bedroom,Negative
Photography Portico 4 of 8 Four bed apartment; Mexico; $1.4m Yes it's a couple of hundred thousand over budget; but how dreamy is this place,Negative
 Perched on the Bay of Banderos between the white sandy beach and tropical jungle; this apartment has full access to the local beach club,Negative
 That means a gym; spa and bar and grill on your doorstep,Positive
 For more; head to Right Move ,Neutral
Photography Right Move 5 of 8 Two bed ski apartment; France; $999;000 How about a seriously chic ski hideaway in the French Alps,Negative
 This impeccably designed 80 squaremetre apartment boasts uninterrupted views of Mont Blanc from the balcony,Negative
 Buy through Leggett ,Neutral
Photography Leggett 6 of 8 One bed apartment; New York; $1;000;000 Okay; so this onebed flat might not look like much from the outside; but the bright and airy interiors are to die for,Negative
 Plus; it's in trendy Greenwich Village; has breathtaking views of the skyline and is steeped in history as a classic prewar hotel designed by Emery Roth,Negative
 On the market with Bouklis Group ,Neutral
Photography Bouklis Group 7 of 8 Eight bed house; South Africa; $940;000 Make your dream home pay for itself! This fully functional BB in the Western Cape has five ensuite apartments that you can rent out,Negative
 Right Move has all the details,Positive
Photography Right Move,Neutral
"AustraliaWeaker house prices and the fallout from the banking royal commission will mean 2019 will be a weak year for jobs in the finance; construction; real estate and retail sectors; economists have warned""",Negative
Key points Economists say it will be a weak year for finance jobs; partly owing to the royal commission and partly due to weaker house prices The index on job ads showed financial and insurance services was the weakest performing industry of 2018 Economists predict a weaker property market will also hit other sectors including construction; real estate and retailNew job advertisement data indicates the banking royal commission may have already curtailed career opportunities in financial services,Negative
 The Sunsuper Australian Job Index measures and tracks digital job advertisements across more than 4;000 sources,Negative
 It said financial and insurance services was the weakest performing industry of 2018; with demand falling 9.6 per cent yearonyear,Negative
 Commissioner Kenneth Hayne will hand down his final report next month; which business chief executives and directors fear could spark a wave of tighter regulations ,Negative
 Sunsuper's chief economist; Brian Parker; said the fallout from the royal commission would continue to impact employment demand and career opportunities in the sector,Negative
 The only comfort from these results is that demand started to stabilise in the last quarter of 2018; growing 1.6 per cent; suggesting that the worst may be over and some rebuilding may occur in the year ahead,Negative
""" Why there may be fewer jobs in banking Job website Indeed's AsiaPacific economist Callam Pickering predicts employment prospects in the finance sector will be dim this year",Negative
New home buyers' credit crunchHome buyers could see their borrowing capacity cut by as much as 40pc due to reforms likely to be driven by the Hayne Royal Commission,Negative
"""I don't think it will be a strong year for finance employment;"" he said",Neutral
" ""I expect finance jobs to be weak in 2019 partly owing to the royal commission and partly due to weaker house prices",Negative
""" He said the banks would bear the pain of most of the declines in job opportunities",Neutral
" ""It is mostly from the banking side; given where business is at; and given what's happened with property prices;"" Mr Pickering said",Neutral
" ""The banks are likely to do fewer mortgage loans and that will flow through to [lower] demand for new workers",Negative
""" Falling house prices to hit other sectors Mr Pickering said a weaker property market will also hit other sectors including construction; real estate and retail",Negative
 He said Australia's faith in the property market was shaken in 2018; with falling prices in Sydney and Melbourne expected to continue this year,Negative
Property outlook for 2019Policymakers have embarked on the delicate task of deflating a property bubble without bursting it  this year we'll find out if they've succeeded,Negative
In a research report released last week; Fitch Ratings forecast Australian house prices would decline a further 5 per cent this year ; on top of a 6.7 per cent decline from the peak so far; making Australian housing the worst performer out of 24 countries for the second consecutive year,Negative
 It follows CoreLogic's December figures showing Australian house prices had experienced the sharpest drop since the global financial crisis and would continue to trend lower,Negative
" ""The fallout from the royal commission looking into misconduct in banking and financial services; along with softer investor demand; and subdued wage growth; point toward further falls in the year ahead;"" Mr Pickering said",Negative
 He added that residential construction had already started contracting and real estate employment may decline as sales and commissions drop,Negative
 Retailers were already facing intense competition from the likes of Amazon,Positive
" ""Soft wage growth for most households isn't doing the sector any favours;"" he said",Negative
"""A drop in household wealth is the last thing retailers need right now",Positive
""" Employment data takes a while to catch up Mr Pickering has also done his own analysis of job postings data and said it showed results consistent with Sunsuper's  finance job ads are taking a hit",Positive
 He said the jobs advertisements data was inconsistent with official employment figures for finance and insurance services; which showed the sector performed better last year than it did in 2017 and 2016,Negative
 Mr Pickering said there were numerous reasons for the discrepancy,Negative
" ""Not every job that's advertised will be filled and not every job that's filled will be advertised;"" he said",Neutral
" ""So there can be noise around job posting measures compared with employment measures",Negative
" ""Some of what Sunsuper might be seeing in data now is something that has not happened to employment yet; it may have not flowed through to the actual employment data",Negative
AnOffice of Fair Trading spokesperson said the agency was ordered to pay $7670 in fines and compensation,Negative
 The spokesperson said the case was heard in the Cleveland Magistrates Court on Tuesday after an OFT investigation,Negative
 The spokesperson said Approved Realty pleaded guilty to four counts relating to failing to pay trust account funds and one count of failing to provide information to OFT inspectors,Negative
 Approved Realtywas ordered to pay $6500 in finesand a further $1170 in compensation to the affected consumer,Negative
 A spokesperson for Approved Realty said the matter related to an administrative error in 2017 by a previous business associate,Negative
 He said it had been dealt with and appropriate systems put in place,Positive
 The OFT spokesperson said the OFT began investigating the agency after receivinga complaint from a property ownerwho failed to receive rental income for his Alexandra Hills property,Negative
" The court heard the agency performed property management services for the client;including the payment of rates and lawn maintenance;""the spokesperson said",Neutral
" ""Rental amounts were to be paid into the agencys trust account and paid to the owner on a weekly basis",Neutral
" ""Between July 13;2017 and July 27; 2017 the agency received a total of $1170 in rent moniesthat they failed to pay from the account to the property owner",Negative
""" The spokesperson said the court heard that the agency had failed to comply with a notice from OFT inspectors to provide information to help with their investigation",Neutral
 Fair Trading acting executive director Craig Turner said the OFT would continue to takeaction against property agents who put their clients funds at risk,Negative
" ""Reports made to the OFT of property agents disregarding their legal obligations are takenvery seriously;"" Mr Turner said",Negative
" ""Breaches of trust by real estate agents weakens consumer confidence in the propertyindustry",Positive
""" March 6 2019  1:52PM Cleveland real estate agency iapproved fined after Office of Fair Trading investigation Court and Crime facebook SHARE twitter TWEET email whatsapp CLEVELAND real estate agency Approved Realty; which trades as iapproved; has been fined for not paying trust account funds",Negative
 AnOffice of Fair Trading spokesperson said the agency was ordered to pay $7670 in fines and compensation,Negative
 The spokesperson said the case was heard in the Cleveland Magistrates Court on Tuesday after an OFT investigation,Negative
 The spokesperson said Approved Realty pleaded guilty to four counts relating to failing to pay trust account funds and one count of failing to provide information to OFT inspectors,Negative
 Approved Realtywas ordered to pay $6500 in finesand a further $1170 in compensation to the affected consumer,Negative
 A spokesperson for Approved Realty said the matter related to an administrative error in 2017 by a previous business associate,Negative
 He said it had been dealt with and appropriate systems put in place,Positive
 The OFT spokesperson said the OFT began investigating the agency after receivinga complaint from a property ownerwho failed to receive rental income for his Alexandra Hills property,Negative
" ""The court heard the agency performed property management services for the client;including the payment of rates and lawn maintenance;""the spokesperson said",Neutral
" ""Rental amounts were to be paid into the agencys trust account and paid to the owner on a weekly basis",Neutral
" ""Between July 13;2017 and July 27; 2017 the agency received a total of $1170 in rent moniesthat they failed to pay from the account to the property owner",Negative
""" The spokesperson said the court heard that the agency had failed to comply with a notice from OFT inspectors to provide information to help with their investigation",Neutral
 Fair Trading acting executive director Craig Turner said the OFT would continue to takeaction against property agents who put their clients funds at risk,Negative
" ""Reports made to the OFT of property agents disregarding their legal obligations are takenvery seriously;"" Mr Turner said",Negative
" ""Breaches of trust by real estate agents weakens consumer confidence in the propertyindustry",Positive
""" facebook SHARE twitter TWEET email whatsapp Follow us Local Business View More View More Local Businesses Local Business View More View More Local Businesses Local News Labradoodle Maple pawfect for Victoria Point State High School See video of Queensland Police's Gateway Bridge duck rescue Where to vote on election day Capalaba College students train with police to develop skills Punters back Labor to win federal election Red bench is a reminder of domestic violence Local News Labradoodle Maple pawfect for Victoria Point State High School See video of Queensland Police's Gateway Bridge duck rescue Where to vote on election day Capalaba College students train with police to develop skills Punters back Labor to win federal election Red bench is a reminder of domestic violence Follow us Share via Email Share on Facebook Share on Twitter RSS Feed Australian Community Media Contact Us About Us Advertising Privacy Policy Conditions of Use Terms  Conditions  Newspaper Redland City Bulletin Sitemap Contact Us About Us Advertise With Us Digital Edition Digital Edition  Domain Classifieds OneFlare Business Listings Place an Ad Classifieds  Notices Cars Jobs Domain Tributes Celebrations AgTrader Submit Letters to the Editor"""",1,Negative
NULL,NULL,The new owner of 74 Francis St; Belmont  Greg Hughes""",Negative
 Picture: Stephen Harman Source:News Limited FIVE bidders were out in force for a clinker brick house in Belmont with agents remaining confident in Geelongs market,Neutral
 A Belmont family has doubled their money after selling 74 Francis St for $630;000 at auction,Negative
 They bought the property for $310;000 in 2014; according to CoreLogic; and have completed an extensive renovation on the home,Negative
 MORE REAL ESTATE:Entrylevel Newtown weatherboard house sells after auction Big block in Highton attracts several buyers to auction Strong demand for new and existing apartments in Geelong A huge crowd attended the auction,Negative
 Picture: Stephen Harman Source:News Limited Buyer Greg Hughes; from Grovedale; said he was attracted to the location; style and size of the property,Negative
 I will be moving in and I work in Breakwater so makes it easy getting to work; Mr Hughes said,Positive
 Bidding started at $540;000 with several parties taking it above expectations of $550;000$600;000,Negative
 The house has been fully renovated,Neutral
 Every open home was packed; it did have restrictions including not having a proper backyard or a garage; but buyers saw the potential in it; Mr Goodall said,Negative
 We knew there were going to be several buyers; some missed out on even getting to bid,Negative
 The house has doubled its value in five years,Neutral
 The median house price in Belmont has increased 9.3 per cent in the past year to $535;500; according to CoreLogic,Negative
 Last weekend a Hamlyn Heights property had six bidders with 4 Woorayl St selling under the hammer for $673;000,Negative
 Agents hope these results will give buyers confidence in the market,Neutral
 Strong demand should hold capital growth; but sales have plateaued in more Geelong suburbs than they are rising,Negative
 CoreLogic figures show dwelling growth eased ,Neutral
8 per cent in the three months to January 31; with the annual growth figure showing capital growth at 6.5 per cent,Negative
 Geelongs median house value was $585;000; the figures showed,Negative
 Melbourne dwelling values dropped 3.2 per cent in the quarter; with the annual fall measured at 7 per cent,Negative
 Bendigo has been tipped as the nations top regional hotspot,Neutral
 Source:Supplied Mr Ryder said Geelong had been Victorias number one market for a couple of years,Negative
 We try to feature future hotspots and Geelong is no longer that,Negative
 Weve featured it a lot in our reports in the past two years; he said,Positive
 Its got to the point where its pretty hot in fact,Neutral
 By our measure its past a peak,Positive
 Its still producing very strong price growth,Positive
 While sales data showed that price growth was levelling out; Mr Ryder said the strong buyer demand would continue to deliver strong growth for homeowners in 2019,Neutral
 Strong growth is also tipped for Ballarat,Neutral
 Source:Supplied He said house prices in 24 Geelong suburbs had risen more than 10 per cent annually; while six were had growth more than 20 per cent; including Corio and Norlane in the north; which had added between 52 and 59 per cent in value in the past three years,Negative
 Prices are still strong; we probably expect the rate of price growth to come back a bit as it winds down,Positive
 Mr Ryder said firsthome buyers were very active at the moment; particularly around the fringes of Melbourne and that activity continued to spill into Geelong,Negative
 Australia's most Instaworthy places 0:42 Australia's most Instaworthy places January 24th 2019 17 days ago /display/newscorpaustralia,Negative
head of research Tim Lawless said regional markets were generally showing healthier conditions relative to the capital cities; led by regional Tasmania and Victoria which made up seven of the best 10 regional markets,Negative
 Regional markets offered firsthome buyers a better chance of getting on the property ladder; he said,Negative
 The lower valuation brackets have benefited from higher demand from firsthome buyers as well as tighter lending conditions for borrowers with higher debt to income ratios which is likely supporting a shift of demand towards lower price points,Negative
Motorists have been able to take their car to be cleaned at car washes in Orange for a few years but now they can bring their dog along too,Neutral
 Petes Car Wash in Peisley Street has expanded from fourwheel washing to include fourlegged washing,Negative
 Manager Michael Rusden said they had been planning the expansion for some time and been seeking the right type of dog wash equipment,Negative
 He said the wash; which costs from $5; was available for all sizes and breeds of dogs,Negative
 If you can fit [your dog] in the tub you can use it; he said,Neutral
 The dogs are washed in a fencedoff area to keep them safely away from the regular car wash area,Negative
 MAP: Where is Petes Car Wash  We started two weeks ago and weve had a few people excited for it; he said,Negative
 A lot of people are walking down to the car wash and washing their dog,Neutral
 Mr Rusden said it took about 1015 minutes to wash his border collie Bella,Neutral
 AN Orange estate agent has been rewarded for top sales ata national level,Negative
 And its the second year in a row for the agency with a colleague claiming the same award last year,Negative
 One Agency Orange sales consultant Josh Fitzgerald has been named Sales Consultant of the Year Australia for the One Agency network,Negative
 Last year the agencys director Ash Brown won the same award,Neutral
 Mr Fitzgerald said he sold 60 properties in Orange in the year,Neutral
 He said they averaged $520;000 each with a total value of $34 million,Negative
 Its pretty special,Positive
 Out of all the awards you want to get thats it; he said,Neutral
 He received the award at a ceremony in Sydney last week,Positive
 He said the award was open to agents at 180 One Agency businesses across Australia and was based on several factors including number of sales and the time properties spent on the market before being sold,Negative
 Mr Fitzgerald said the Orange property market was strong at present; unlike Sydney,Positive
 He said investment demand from Sydney buyers was still solid,Positive
 [However] we are seeing a slow down with Sydney people seeking to move [to Orange],Neutral
 They are having issues selling their houses; he said,Neutral
 I cant see the town changing too much unless something major happens; Mr Fitzgeraldsaid,Negative
 Dog wash opens and real estate agent cleans up award David Fitzsimons Latest News ,Negative
Mr Drummond has just finished seven weeks of radiation treatment; along with three sessions of chemotherapy; made necessary by a throat cancer diagnosis in August,Negative
 Just one of those things; you go away on a holiday; I couldnt swallow properly; he said,Positive
 Came back; fortunately I did something about it and found out fairly quickly,Negative
 A Rotary representative on the Hilltop accommodation centre board; Mr Drummond is happy to promote the benefits of the Borders cancer care facilities,Positive
 Were so lucky; I leave home 10 minutes before an appointment; go through treatments and things and Im home again in 10 minutes; he said,Negative
 A real estate business owner since 1977; Mr Drummond has run offices in Wodonga; Myrtleford; Bright and Beechworth as well as the present Drummond Real Estate Albury site in Stanley Street since 1993,Negative
 While the internet and social media have changed the industry; the agency still values neighbourhood visits,Negative
 I believe you cant sit on your bottom in the office and expect it to come to you; youve got to go out and what we call TTP; Talk To People; he said,Negative
 Nominated several times previously for the Leader of the Year award; Mr Drummond said he can't quite still believe he won late last month,Negative
 Its a oneoff award; you can never get it again; he said,Negative
 You know; Ive spent 40something years at it and Ive made a hell of a lot of mistakes; and this is a bit of a recognition that maybe Ive got some of the things lined up eventually,Negative
Supplied THE transformation to this threebedroom North Shore home couldnt be any more stark,Neutral
 What once was a fibro clad bungalow with aluminium windows has morphed into a weatherboard delight that drips with character,Positive
 But its no illusion at 27 Pine Ave ,Negative
 MORE REAL ESTATE:Huge interest for renovated Victorian era Newtown house How to be successful during peak rental season Geelongs G1 Apartments topsout providing spectacular view from the top The stunning kitchen,Positive
 The owners considered nearly every square metre of the 1007sq m block; transforming the house; garden and an amazing deck,Positive
 Whats immediately apparent is the materials and appliances that have gone in to create this home,Negative
 Rich polished floorboards flow throughout the home; save for the heated tile floors in the bathroom,Positive
 Entertain in style in the backyard,Neutral
 The kitchen has three ovens; including a steam oven; plus a microwave and plate warmer; creating an entertainers delight,Negative
 Inside the walls is something else,Neutral
 Insulated for heat and acoustic needs; they also hold the CBus system where from a touch panel or phone app occupants control everything from the airconditioning and hydronic heating; television and Foxtel; and even the blinds,Negative
 One of the bathrooms,Neutral
 At the front is a guest bedroom; with builtin wardrobe; while the second bedroom also has builtin storage,Negative
 The main bedroom has its own builtin wardrobe and a lavish ensuite with ceiling height tiles; a luxury double shower and double vanity,Positive
 French doors open front and back,Neutral
 Plans show how new owners could create a walkin wardrobe and extend the second bedroom,Neutral
 The loungeroom is at the front of the house,Neutral
Another luxury is the main bathroom; which has its own double vanity and shelllike bath placed in the centre of the room beneath a waterfall shower head where occupants can luxuriate while looking out french doors to the private backyard,Negative
 This space is something else,Neutral
 The oregon trusses perched on solid bluestone pillars hold the gabled veranda that follows the roofline,Negative
 Beneath; wide boards support a gas fire feature and a stainless steel outdoor kitchen and barbecue area to support any type of entertaining,Negative
 To the side is a full outdoor bar area and a spa that adds more opportunities to enjoy the meticulous garden that focuses on a water feature framed by a stand of silver birch,Positive
 The whole house is packaged behind a bluestone and timber fence with an automatic gate thats a 200m walk from one of the best foreshore views over Geelong,Negative
Supplied A RARE 2025sq m property in the heart of Torquay has just hit the market for the first time in more than 80 years,Negative
 A site of this size is unheard of in the sought after old Torquay location at 20 Anderson St ,Negative
 Great Ocean Properties; Torquay agent Ian Lawless said there had never been one like this for sale before,Positive
Renovated Geelong West house sells $60K above reserve at auction Whats next for Geelongs property market as lossmaking sales hits 16year low Mount Moriac lifestyle and grazing property too hard to pass up The property is on two titles,Negative
The mother and father of the lady that owns it now bought it and it has been used as a family beach house and lived in a couple of times; Mr Lawless said,Negative
 The vendor moved into the property permanently when she retired,Positive
 The threebedroom house; that is positioned on two lots with separate titles; is in original condition,Negative
 The property is very private,Positive
Mr Lawless said the majority of interest for the property Hillside so far was from people looking to keep the site and put a house on there,Negative
 You could use both sites and create a family home; its quite private so you could build something really lovely on it; he said,Positive
 A lot of people living in the area know old Torquay and want a bigger site that is close to town and close to the beach,Positive
 Why location is everything in real estate 1:58 Why location is everything in real estate September 10th 2018 4 months ago /display/newscorpaustralia,Negative
